sciNameValid,source,dbid,gbAccession,kingdom,phylum,class,order,family,genus,sciNameOrig,fbSpecCode,country,catalogNumber,institutionCode,decimalLatitude,decimalLongitude,publishedAs,publishedIn,publishedBy,date,notesGenBank,genbankVersion,searchDate,metabarcode,numberHaplotypes,length,nucleotides
Oreochromis niloticus,GENBANK,225421141,FJ792637.1,Animalia,Chordata,Actinopterygii,Perciformes,Cichlidae,Oreochromis,Oreochromis niloticus,2,Thailand,KUGEN_ECpf-OG14,NA,NA,NA,Development of molecular markers for pufferfish identifications in Thailand,Unpublished,"Sangthong,P.",25-MAR-2009,"Oreochromis niloticus 12S ribosomal RNA gene, partial sequence; mitochondrial",258,10 Dec 2023,12s.miya,1,168,cgccgcggttatacgagaggctcaagttgacggacatcggcgtaaagagtggttaggaagtctttcaaactaaagccgaacgccctcagaactgttatacgtacccgagggtaagaagcccccctacgaaagtggctttatatctccgaccccacgaaagctgcgaaa
Oreochromis niloticus,GENBANK,281428845,NC_013663.1,Animalia,Chordata,Actinopterygii,Perciformes,Cichlidae,Oreochromis,Oreochromis niloticus,2,NA,NA,NA,NA,NA,Complete mitochondrial genome DNA of the Nile tilapia Oreochromis niloticus and phylogenetic analysis,Unpublished,"Yang,L.",22-DEC-2009,"Oreochromis niloticus mitochondrion, complete genome",258,10 Dec 2023,12s.miya,5,168,caccgcggttatacgagaggctcaagttgatagacatcggcgtaaagagtggttaggaagtcttttaaactaaagccgaataccctcagaactgttatacgtacccgagggaaagaagccccactacgaaagtggctttatatctccgaccccacgaaagctgcgaaa
Oreochromis niloticus,GENBANK,291002187,GU477626.1,Animalia,Chordata,Actinopterygii,Perciformes,Cichlidae,Oreochromis,Oreochromis niloticus,2,NA,NA,NA,NA,NA,The complete mitochondrial genome and phylogenetic analysis of tilapia,Unpublished,"Jiang,Z.",31-JAN-2011,"Oreochromis niloticus strain Philippines mitochondrion, complete genome",258,10 Dec 2023,12s.miya,2,168,caccgcggttatacgagaggctcaagttgacggacatcggcgtaaagagtggttaggaagtctttcaaactaaagccgaacgccctcagaactgttatacgtacctgagggtaagaagcccccctacgaaagtggctttatatctccgaccccacgaaagctgcgaaa
Oreochromis niloticus,GENBANK,291002215,GU477628.1,Animalia,Chordata,Actinopterygii,Perciformes,Cichlidae,Oreochromis,Oreochromis niloticus,2,NA,NA,NA,NA,NA,The complete mitochondrial genome and phylogenetic analysis of tilapia,Unpublished,"Jiang,Z.",31-JAN-2011,"Oreochromis niloticus strain America mitochondrion, complete genome",258,10 Dec 2023,12s.miya,8,168,caccgcggttatacgagaggctcaagttgacggacatcggcgtaaagagtggttaggaagtctttcaaactaaagccgaacgccctcagaactgttatacgtacccgagggtaagaagcccccctacgaaagtggctttatatctccgaccccacgaaagctgcgaaa
Remora remora,GENBANK,752502870,AB938136.1,Animalia,Chordata,Actinopterygii,Perciformes,Echeneidae,Remora,Remora remora,1751,"Japan:Kyoto, Maizuru, Kammuri-jima Island",CBM:ZF:14848,NA,NA,NA,"MiFish, a set of universal PCR primers for metabarcoding environmental DNA from fishes: detection of more than 230 subtropical marine species","R Soc Open Sci 2 (7), 150088 (2015)","Miya,M.",03-FEB-2015,"Remora remora mitochondrial gene for 12S rRNA, partial sequence, specimen_voucher: CBM:ZF:14848",258,10 Dec 2023,12s.miya,3,168,caccgcggttatacgaggggcccaagttgacagataacggcgtaaagcgtggttaggggtaacctaaactaaagccgaataccttcaggactgttatacgtttccgaaggaatgaagcccaactacgaaagtggctttacaaaacctgactccacgaaagctaagaaa
Lepidocybium flavobrunneum,GENBANK,1209184588,LC278032.1,Animalia,Chordata,Actinopterygii,Perciformes,Gempylidae,Lepidocybium,Lepidocybium flavobrunneum,1042,NA,FRLM:40511,NA,NA,NA,"Reference data of mitochondrial 12S ribosomal RNA gene, partial sequence for eDNA analyzing",Unpublished,"Miya,M.",21-JUN-2017,"Lepidocybium flavobrunneum mitochondrial gene for 12S rRNA, partial sequence, specimen_voucher: FRLM:40511",258,10 Dec 2023,12s.miya,1,172,aaccgcggttatacgagaggcccaagttgacagaccccggcgtaaagggtggttaaggtagactaaaactaaagccgaacaccttcagggcagtcatacgcatcccgaagccacgaagccccaccacgaaagtggctttattcccccccccgaccccacgaaagctatgaaa
Lepidocybium flavobrunneum,GENBANK,2307998541,LC729814.1,Animalia,Chordata,Actinopterygii,Perciformes,Gempylidae,Lepidocybium,Lepidocybium flavobrunneum,1042,"Japan:Kochi, Otsuki, off Ashizuri",Kuroshio Biological Research Foundation KBF-I 947,NA,NA,NA,Reference data for MiFish metabarcoding analysis,Unpublished,"Sado,T.",22-SEP-2022,"Lepidocybium flavobrunneum KBF-I 947 mitochondrial gene for 12S rRNA, partial sequence",258,10 Dec 2023,12s.miya,1,170,aaccgcggttatacgagaggcccaagttgacagaccccggcgtaaagggtggttaaggtagactaaaactaaagccgaacaccttcagggcagtcatacgcatcccgaagccacgaagccccaccacgaaagtggctttattcccccccgaccccacgaaagctatgaaa
Lepidocybium flavobrunneum,GENBANK,2491776993,OQ846188.1,Animalia,Chordata,Actinopterygii,Perciformes,Gempylidae,Lepidocybium,Lepidocybium flavobrunneum,1042,USA,#09-131,NA,NA,NA,Improving metabarcoding taxonomic assignment: A case study of fishes in a large marine ecosystem,"Mol Ecol Resour 21 (7), 2546-2564 (2021)","Gold,Z.",24-APR-2023,"Lepidocybium flavobrunneum voucher #09-131 small subunit ribosomal RNA gene, partial sequence; mitochondrial",258,10 Dec 2023,12s.miya,1,169,aaccgcggttatacgagaggcccaagttgacagaccccggcgtaaagggtggttaaggtagactaaaactaaagccgaacaccttcagggcagtcatacgcatcccgaagccacgaagccccaccacgaaagtggctttattccccccgaccccacgaaagctatgaaa
Lepidocybium flavobrunneum,GENBANK,2580277082,OP035316.2,Animalia,Chordata,Actinopterygii,Perciformes,Gempylidae,Lepidocybium,Lepidocybium flavobrunneum,1042,NA,USNM:FISH:407069,NA,NA,NA,Mitochondrial Genomes of Fishes Derived by Genome Skimming,Unpublished,"Bemis,K.",07-DEC-2022,"Lepidocybium flavobrunneum voucher USNM:FISH:407069 mitochondrion, complete genome",258,10 Dec 2023,12s.miya,1,173,aaccgcggttatacgagaggcccaagttgacagactccggcgtaaagggtggttaaggtagactaaaactaaagccgaacaccttcagggcagtcatacgcatcccgaagccacgaagccccaccacgaaagtggctttattccccccccccgaccccacgaaagctatgaaa
Lepidocybium flavobrunneum,GENBANK,542132657,AP012519.1,Animalia,Chordata,Actinopterygii,Perciformes,Gempylidae,Lepidocybium,Lepidocybium flavobrunneum,1042,NA,CBM:ZF:12751,NA,NA,NA,Evolutionary origin of the scombridae (tunas and mackerels): members of a paleogene adaptive radiation with 14 other pelagic fish families,"PLoS ONE 8 (9), E73535 (2013)","Miya,M.",12-SEP-2013,"Lepidocybium flavobrunneum mitochondrial DNA, nearly complete genome",258,10 Dec 2023,12s.miya,2,173,aaccgcggttatacgagaggcccaagttgacagaccccggcgtaaagggtggttaaggtagactaaaactaaagccgaacaccttcagggcagtcatacgcatcccgaagccacgaagccccaccacgaaagtggctttattccccccccccgaccccacgaaagctatgaaa
Lepidocybium flavobrunneum,GENBANK,985566856,LC069791.1,Animalia,Chordata,Actinopterygii,Perciformes,Gempylidae,Lepidocybium,Lepidocybium flavobrunneum,1042,NA,CBM:ZF:14781,NA,NA,NA,"mitochondrial gene for 12S ribosomal RNA, partial sequence of fishes",Unpublished,"Miya,M.",03-FEB-2016,"Lepidocybium flavobrunneum mitochondrial gene for 12S rRNA, partial sequence, specimen_voucher: CBM:ZF:14781",258,10 Dec 2023,12s.miya,1,169,aaccgcggttatacgagaggcccaagttgacagaccccggcgtaaagggtggttaaggtagactaaaactaaagccgaacaccttcagggcagtcatacgcatcccgaagccacgaagccccaccacgaaagtggctttatttcccccgaccccacgaaagctatgaaa
Nesiarchus nasutus,GENBANK,542132433,AP012503.1,Animalia,Chordata,Actinopterygii,Perciformes,Gempylidae,Nesiarchus,Nesiarchus nasutus,7573,NA,NSMT:P:75668,NA,NA,NA,Evolutionary origin of the Scombridae (tunas and mackerels): members of a paleogene adaptive radiation with 14 other pelagic fish families,"PLoS ONE 8 (9), E73535 (2013)","Miya,M.",12-SEP-2013,"Nesiarchus nasutus mitochondrial DNA, complete genome",258,10 Dec 2023,12s.miya,2,169,caccgcggttatacgggagacccaagttgacaaacaacggcgtaaagagtggttaggggatttactaaactagagccgaacgctttcaaagctgttatacgcacccgaaagtatgaaacccaattacgaaagtagctctacttatcctgaacccacgaaagctaaggaa
Ruvettus pretiosus,GENBANK,2580278386,OP057060.2,Animalia,Chordata,Actinopterygii,Perciformes,Gempylidae,Ruvettus,Ruvettus pretiosus,1044,NA,SIO:dc3153b0-3cc0-4df6-a4c1-232087f35fab,NA,NA,NA,Mitochondrial Genomes of Fishes Derived by Genome Skimming,Unpublished,"Bemis,K.",21-NOV-2022,"Ruvettus pretiosus voucher SIO:dc3153b0-3cc0-4df6-a4c1-232087f35fab mitochondrion, complete genome",258,10 Dec 2023,12s.miya,6,168,caccgcggttatacgagaggcccaagttgacagacaccggcgtaaagcgtggttaaggaaaacttaaactaaagtcgaacaccttcaaagcagttatacgcatccggaggtacgaagccccaccacgaaagtggctttattacccctgaccccacgaaagctatgaca
Aphia minuta,GENBANK,146330276,EF218623.1,Animalia,Chordata,Actinopterygii,Perciformes,Gobiidae,Aphia,Aphia minuta,39,Italy,NA,NA,NA,NA,Molecular phylogeny of the three paedomorphic mediterranean gobies (Perciformes: Gobiidae),"J. Exp. Zool. B Mol. Dev. Evol. 308 (6), 722-729 (2007)","Giovannotti,M.",25-NOV-2007,"Aphia minuta 12S ribosomal RNA gene, partial sequence; mitochondrial",258,10 Dec 2023,12s.miya,1,168,caccgcggttatacgagaggcccgtgttgacacacaccggcgtaaagagtggttaatagagtttttaactaaggtcgaacatcttcaaggctgttatacgcacccgaagacaggaagtgcccccacgaaagtggccttaagtagtatgaatccacgaaagctagggaa
Aphia minuta,GENBANK,2018537055,MW818216.1,Animalia,Chordata,Actinopterygii,Perciformes,Gobiidae,Aphia,Aphia minuta,39,United Kingdom: River Test,NA,NA,50.9013,-1.4406,"A generalised, dynamic DNA reference library pipeline for metabarcoding of fishes",Unpublished,"Collins,R.A.",31-MAR-2021,"Aphia minuta isolate SEA0133 small subunit ribosomal RNA gene, partial sequence; mitochondrial",258,10 Dec 2023,12s.miya,1,168,caccgcggttatacgagaggcccgtgttgacacacaccggcgtaaagagtggttaatagagtttttaactaaggtcgaacatcttcaaggctgttatacgcacccgaagacaggaagtgcccccacgaaagtggccttaaataatatgaatccacgaaagctagggaa
Aphia minuta,GENBANK,2018537056,MW818217.1,Animalia,Chordata,Actinopterygii,Perciformes,Gobiidae,Aphia,Aphia minuta,39,United Kingdom: River Test,NA,NA,50.9013,-1.4406,"A generalised, dynamic DNA reference library pipeline for metabarcoding of fishes",Unpublished,"Collins,R.A.",31-MAR-2021,"Aphia minuta isolate SEA0134 small subunit ribosomal RNA gene, partial sequence; mitochondrial",258,10 Dec 2023,12s.miya,1,168,caccgcggttatacgaggggcccgtgttgacacacaccggcgtaaagagtggttaatagagtttttaactaaggtcgaacatcttcaaggctgttatacgcacccgaagacaggaagtgcccccacgaaagtggccttaaataatatgaatccacgaaagctagggaa
Aphia minuta,GENBANK,2188144273,OM509547.1,Animalia,Chordata,Actinopterygii,Perciformes,Gobiidae,Aphia,Aphia minuta,39,Atlantic Ocean: English Channel (France),NA,NA,NA,NA,In prep : Coastal rocky reef fish monitoring in the context of the Marine Strategy Framework Directive: environmental DNA metabarcoding complements underwater visual census,Unpublished,"Rey,A.",09-FEB-2022,"Aphia minuta isolate F53 small subunit ribosomal RNA gene, partial sequence; mitochondrial",258,10 Dec 2023,12s.miya,1,130,ggcgtaaagagtggttaatagagtttttaactaaggtcgtacatcttcaaggctgttatacgcacccgaagacaggaagtgcccccacgaaagtggccttaaataatatgaatccacgaaagctagggaa
Crystallogobius linearis,GENBANK,146330288,EF218635.1,Animalia,Chordata,Actinopterygii,Perciformes,Gobiidae,Crystallogobius,Crystallogobius linearis,60,Italy,NA,NA,NA,NA,Molecular phylogeny of the three paedomorphic mediterranean gobies (Perciformes: Gobiidae),"J. Exp. Zool. B Mol. Dev. Evol. 308 (6), 722-729 (2007)","Giovannotti,M.",25-NOV-2007,"Crystallogobius linearis 12S ribosomal RNA gene, partial sequence; mitochondrial",258,10 Dec 2023,12s.miya,1,168,caccgcggttatacgagaggcccaaattgacgcccgtcggcataaaatgcggttaattatagtaatgcactaaaaccaaatgccctcaaagctgttatacgcacccgagggttagaggatctataacgaaggtagttttaaacattatgacccgcgaaagctaggaaa
Crystallogobius linearis,GENBANK,1799624505,MN122854.1,Animalia,Chordata,Actinopterygii,Perciformes,Gobiidae,Crystallogobius,Crystallogobius linearis,60,NA,NA,NA,NA,NA,DNAmark project,Unpublished,"Margaryan,A.",27-JAN-2020,"Crystallogobius linearis mitochondrion, complete genome",258,10 Dec 2023,12s.miya,1,168,caccgcggttatacgagagacccaaattgataaccatcggcataaaacgcggttaattatagccatccactaaaaccaaatgccctcaaagctgttatacgcacccgagcgtcagaggatcttttacgaaagtagttttaaacactatgacccgcgaaagctagggaa
Gobius cobitis,GENBANK,146330282,EF218629.1,Animalia,Chordata,Actinopterygii,Perciformes,Gobiidae,Gobius,Gobius cobitis,4579,Italy,NA,NA,NA,NA,Molecular phylogeny of the three paedomorphic mediterranean gobies (Perciformes: Gobiidae),"J. Exp. Zool. B Mol. Dev. Evol. 308 (6), 722-729 (2007)","Giovannotti,M.",25-NOV-2007,"Gobius cobitis 12S ribosomal RNA gene, partial sequence; mitochondrial",258,10 Dec 2023,12s.miya,1,167,caccgcggttatacgagaggcccgagttgacgaaaatcggcgtaaagagtggttaatgagaactatactaaggccaaacaccttcaaggctgttatacgctcccgaagacaggagggaccctcacgaaagtagctttaatcatcatgactccacgaaagccggggaa
Gobius cobitis,GENBANK,2188144268,OM509545.1,Animalia,Chordata,Actinopterygii,Perciformes,Gobiidae,Gobius,Gobius cobitis,4579,Atlantic Ocean: English Channel (France),NA,NA,NA,NA,In prep : Coastal rocky reef fish monitoring in the context of the Marine Strategy Framework Directive: environmental DNA metabarcoding complements underwater visual census,Unpublished,"Rey,A.",09-FEB-2022,"Gobius cobitis isolate F78 small subunit ribosomal RNA gene, partial sequence; mitochondrial",258,10 Dec 2023,12s.miya,1,163,gcggttatacgagaggcccgagttgacgaaaatcggcgtaaagagtggttaatgaggactatactaaggccaaacaccttcaaggctgttatacgctcccgaagacaggagggaccctcacgaaagtagctttaatcatcatgactccacgaaagccgggaaa
Gobius cruentatus,GENBANK,146330279,EF218626.1,Animalia,Chordata,Actinopterygii,Perciformes,Gobiidae,Gobius,Gobius cruentatus,7648,Italy,NA,NA,NA,NA,Molecular phylogeny of the three paedomorphic mediterranean gobies (Perciformes: Gobiidae),"J. Exp. Zool. B Mol. Dev. Evol. 308 (6), 722-729 (2007)","Giovannotti,M.",25-NOV-2007,"Gobius cruentatus 12S ribosomal RNA gene, partial sequence; mitochondrial",258,10 Dec 2023,12s.miya,1,167,caccgcggttatacgaggggcccaagttgacgaaaaccggcgtaaagcgtggttaatgatacacacactaaagccaaataccctcctggctgttatacgcacccgagagtaagaggaactttcacgaaagtagctttaataaacatgaccccacgagagctagggaa
Gobius niger,GENBANK,2510680055,OX637619.1,Animalia,Chordata,Actinopterygii,Perciformes,Gobiidae,Gobius,Gobius niger,72,NA,NA,NA,NA,NA,Direct Submission,"Submitted (25-MAY-2023) WELLCOME SANGER INSTITUTE, Tree of Life, Wellcome Genome Campus, Hinxton CB10 1SA, United Kingdom",NA,25-MAY-2023,"Gobius niger genome assembly, organelle: mitochondrion",258,10 Dec 2023,12s.miya,7,167,caccgcggttatacgagggacccaagttgacagaaaccggcgtaaagagtggttaatataatataaactaaagcaatacaccctcaaagctgttataagctcccgagggcaggagtagctttcacgaaagtggctttaatcaatatgaatccacgagaactagggaa
Gobius paganellus,GENBANK,2018537143,MW818304.1,Animalia,Chordata,Actinopterygii,Perciformes,Gobiidae,Gobius,Gobius paganellus,73,United Kingdom: River Test,NA,NA,50.9013,-1.4406,"A generalised, dynamic DNA reference library pipeline for metabarcoding of fishes",Unpublished,"Collins,R.A.",31-MAR-2021,"Gobius paganellus isolate SEA0142 small subunit ribosomal RNA gene, partial sequence; mitochondrial",258,10 Dec 2023,12s.miya,4,167,caccgcggttatacgagaggcccaagttgacgaaaatcggcgtaaagcgtggttaatgagaccataactaaagccgaacgccctcaaggctgttatacgcccccgaagacaggaagtcccgtcacgaaagtagctttaaccatcatgaacccacgagagctagggaa
Gobius paganellus,GENBANK,2018537155,MW818316.1,Animalia,Chordata,Actinopterygii,Perciformes,Gobiidae,Gobius,Gobius paganellus,73,United Kingdom: River Test,NA,NA,50.9013,-1.4406,"A generalised, dynamic DNA reference library pipeline for metabarcoding of fishes",Unpublished,"Collins,R.A.",31-MAR-2021,"Gobius paganellus isolate SEA0141 small subunit ribosomal RNA gene, partial sequence; mitochondrial",258,10 Dec 2023,12s.miya,1,167,caccgcggttatacgagaggcccaagttgacgaaaatcggcgtaaagcgtggttaatgagaccataactaaagccgaacgccctcaaggctgttatacgcccccgaagaccggaagtcccgtcacgaaagtagctttaaccatcatgaacccacgagagctagggaa
Gobiusculus flavescens,GENBANK,1898139810,MT410909.1,Animalia,Chordata,Actinopterygii,Perciformes,Gobiidae,Gobiusculus,Gobiusculus flavescens,74,NA,NA,NA,NA,NA,DNAmark Project,Unpublished,"Margaryan,A.",06-SEP-2020,"Gobiusculus flavescens isolate DM513 mitochondrion, complete genome",258,10 Dec 2023,12s.miya,2,170,caccgcggttatacgagaggcccaagttgacggatgccggcgtaaaatgtggttaatttacagtattacaataaagcaaaacaccttctaagctgttatatgctctcgaagacaggaggcccctttacgaaagtagctttaaacaatatgaccccacgaaagctagggaa
Gobiusculus flavescens,GENBANK,2018537242,MW818403.1,Animalia,Chordata,Actinopterygii,Perciformes,Gobiidae,Gobiusculus,Gobiusculus flavescens,74,United Kingdom: River Test,NA,NA,50.9013,-1.4406,"A generalised, dynamic DNA reference library pipeline for metabarcoding of fishes",Unpublished,"Collins,R.A.",31-MAR-2021,"Gobiusculus flavescens isolate SEA0464 small subunit ribosomal RNA gene, partial sequence; mitochondrial",258,10 Dec 2023,12s.miya,1,170,caccgcggttatacgagaggcccaagttgacggatgccggcgtaaaatgtggttaatttacagtattacactaaagcaaaacaccttctaagctgttatatgctctcgaagacaggaggcccctttacgaaagtagctttaagcaatatgaccccacgaaagctagggaa
Lesueurigobius friesii,GENBANK,1980526588,NC_052760.1,Animalia,Chordata,Actinopterygii,Perciformes,Gobiidae,Lesueurigobius,Lesueurigobius friesii,7685,NA,NA,NA,NA,NA,DNAmark Project,Unpublished,"Margaryan,A.",09-FEB-2021,"Lesueurigobius friesii isolate DM418 mitochondrion, complete genome",258,10 Dec 2023,12s.miya,3,168,caccgcggttatacgagaggcccatgttgacaaacatcggcgtaaagagtggttaatagaatctttaactaaggtcgaacatcttcaaggctgttatacgcatccgaaggcaggaagccctcctacgaaagtgaccttaactagtatgaccccacgaaagctagggaa
Neogobius melanostomus,GENBANK,2082965266,MZ827017.1,Animalia,Chordata,Actinopterygii,Perciformes,Gobiidae,Neogobius,Neogobius melanostomus,12019,"USA: New York, Oneida Lake",round_goby_2,NA,43.15968,-75.88634,Environmental DNA metabarcoding detects biodiversity and spatial heterogeneity in Oneida Lake: A comparison with traditional surveys,Unpublished,"Andres,K.J.",24-AUG-2021,"Neogobius melanostomus voucher round_goby_2 small subunit ribosomal RNA gene, partial sequence; mitochondrial",258,10 Dec 2023,12s.miya,1,171,caccgcgggttatacgagaggcccaagttgacaaaaatcggcgaaaagcgtggttagtgatatcacctccactaaagccaaacaccttcaaggctgtaatacgcccccgaagacaggaagcccaatcacgaaagtagctttaattttcatgaagccacgaaagctaggaaa
Neogobius melanostomus,GENBANK,2082965267,MZ827018.1,Animalia,Chordata,Actinopterygii,Perciformes,Gobiidae,Neogobius,Neogobius melanostomus,12019,"USA: New York, Oneida Lake",round_goby_3,NA,43.15968,-75.88634,Environmental DNA metabarcoding detects biodiversity and spatial heterogeneity in Oneida Lake: A comparison with traditional surveys,Unpublished,"Andres,K.J.",24-AUG-2021,"Neogobius melanostomus voucher round_goby_3 small subunit ribosomal RNA gene, partial sequence; mitochondrial",258,10 Dec 2023,12s.miya,2,169,caccgcggttatcgagaggcccaagttgacaaaaatcggcgaaaagcgtggttagtgatatcacctccactaaagccaaacaccttcaaggctgtaatacgcccccgaagacaggaagcccaatcacgaaagtagctttaattttcatgaagccacgaaagctaggaaa
Neogobius melanostomus,GENBANK,2325477630,OM736801.1,Animalia,Chordata,Actinopterygii,Perciformes,Gobiidae,Neogobius,Neogobius melanostomus,12019,USA,NEFC_F20-100,NA,NA,NA,Freshwater Fish Mitochondrial Genome Project,Unpublished,"Maloy,A.P.",09-NOV-2022,"Neogobius melanostomus voucher NEFC_F20-100 mitochondrion, complete genome",258,10 Dec 2023,12s.miya,8,170,caccgcggttatacgagaggcccaagttgacaaaaatcggcgaaaagcgtggttagtgatatcacctccactaaagccaaacaccttcaaggctgtaatacgcccccgaagacaggaagcccaatcacgaaagtagctttaattttcatgaagccacgaaagctaggaaa
Pomatoschistus microps,GENBANK,1799624463,MN122842.1,Animalia,Chordata,Actinopterygii,Perciformes,Gobiidae,Pomatoschistus,Pomatoschistus microps,1344,NA,NA,NA,NA,NA,DNAmark project,Unpublished,"Margaryan,A.",27-JAN-2020,"Pomatoschistus microps mitochondrion, complete genome",258,10 Dec 2023,12s.miya,9,170,caccgcggttatacgagaggcccaagttgatggatgccggcgtaaaatgtggttaatttacagtattacactaaagcgaaacaccttctaagctgttatatgctttcgaaggcaggagcccctcttacgaaagtagctttaaacgatatgaccccacgaaagctagggaa
Pomatoschistus minutus,GENBANK,146330286,EF218633.1,Animalia,Chordata,Actinopterygii,Perciformes,Gobiidae,Pomatoschistus,Pomatoschistus minutus,1345,Italy,NA,NA,NA,NA,Molecular phylogeny of the three paedomorphic mediterranean gobies (Perciformes: Gobiidae),"J. Exp. Zool. B Mol. Dev. Evol. 308 (6), 722-729 (2007)","Giovannotti,M.",25-NOV-2007,"Pomatoschistus minutus 12S ribosomal RNA gene, partial sequence; mitochondrial",258,10 Dec 2023,12s.miya,1,170,caccgcggttatacgagaggcccaagttgatggatgccggcgtaaaatgtggttaatttacagtattacactaaagcaaaacaccttctaagctgttatatgctctcgaagacaggaggcccttttacgaaagtagctttaaatagtatgaccccacgaaagctagggaa
Pomatoschistus minutus,GENBANK,2018537131,MW818292.1,Animalia,Chordata,Actinopterygii,Perciformes,Gobiidae,Pomatoschistus,Pomatoschistus minutus,1345,United Kingdom: River Test,NA,NA,50.9013,-1.4406,"A generalised, dynamic DNA reference library pipeline for metabarcoding of fishes",Unpublished,"Collins,R.A.",31-MAR-2021,"Pomatoschistus minutus isolate SEA0365 small subunit ribosomal RNA gene, partial sequence; mitochondrial",258,10 Dec 2023,12s.miya,8,170,caccgcggttatacgagaggcccaagttgatggatgccggcgtaaaatgtggttaatttacagtattacactaaagcaaaacaccttctaagctgttatatgctctcgaagacaggaggcccttttacgaaagtagctttaaatggtatgaccccacgaaagctaggaaa
Pomatoschistus pictus,GENBANK,2018537097,MW818258.1,Animalia,Chordata,Actinopterygii,Perciformes,Gobiidae,Pomatoschistus,Pomatoschistus pictus,1347,United Kingdom: River Test,NA,NA,50.9013,-1.4406,"A generalised, dynamic DNA reference library pipeline for metabarcoding of fishes",Unpublished,"Collins,R.A.",31-MAR-2021,"Pomatoschistus pictus isolate SEA0382 small subunit ribosomal RNA gene, partial sequence; mitochondrial",258,10 Dec 2023,12s.miya,3,169,caccgcggttatacgagaggcccaagttgatggatgccggcgtaaaatgtggttaatttacattgttgcactaaagcaaaacaccttctaagctgttatatgctctcgaagacaggaagcccttttacgaaagtagctttaaatagtatgacccacgaaagctagggaa
Pomatoschistus pictus,GENBANK,2018537159,MW818320.1,Animalia,Chordata,Actinopterygii,Perciformes,Gobiidae,Pomatoschistus,Pomatoschistus pictus,1347,United Kingdom: River Test,NA,NA,50.9013,-1.4406,"A generalised, dynamic DNA reference library pipeline for metabarcoding of fishes",Unpublished,"Collins,R.A.",31-MAR-2021,"Pomatoschistus pictus isolate SEA0150 small subunit ribosomal RNA gene, partial sequence; mitochondrial",258,10 Dec 2023,12s.miya,1,169,caccgcggttatacgagaggcccaagttgatggatgccggcgtaaaatgtggttaatttacattgttgcactaaagcaaaacaccttctaagctgttatatgctctcgaagacaggaaacccttttacgaaagtagctttaaatagtatgacccacgaaagctagggaa
Pomatoschistus pictus,GENBANK,2028741896,MW995378.1,Animalia,Chordata,Actinopterygii,Perciformes,Gobiidae,Pomatoschistus,Pomatoschistus pictus,1347,Denmark,P2395450,NA,NA,NA,Short-term temporal variation of coastal marine eDNA,Environ DNA (2022) In press,"Jensen,M.R.",01-JAN-2022,"Pomatoschistus pictus voucher P2395450 small subunit ribosomal RNA gene, partial sequence; mitochondrial",258,10 Dec 2023,12s.miya,2,169,caccgcggttatacgagaggcccaagttgatggatgccggcgtaaaatgtggttaatttacattgttgcactaaagcaaaacaccttctaagctgttatatgctctcgaagacaggaagcccttttacgaaagtagctttaaatagtataacccacgaaagctagggaa
Howella brodiei,GENBANK,2497635841,OQ883813.1,Animalia,Chordata,Actinopterygii,Perciformes,Howellidae,Howella,Howella brodiei,11780,NA,WHOI:OTZ_73,NA,39.29133,-68.93385,Mesopelagic fish diversity and diel vertical migration in the Northwest Atlantic Slope Sea,Unpublished,"Govindarajan,A.",28-NOV-2023,"Howella brodiei isolate HB1907_MWT10_83 small subunit ribosomal RNA gene, partial sequence; mitochondrial",258,10 Dec 2023,12s.miya,1,170,caccgcggttatacgagaggctcgagttgagagaactacggcgtaaagggtggttaagataacttaaaaaataaagccgaaccccctcaacactgtaatacgcccccgaggggaggaagcccaatcacgaaagtggctttacaactcctgaacccacgaaagctagggca
Howella brodiei,GENBANK,675821318,AP014536.1,Animalia,Chordata,Actinopterygii,Perciformes,Howellidae,Howella,Howella brodiei,11780,NA,NA,NA,NA,NA,Mitogenomic phylogeny of the Percichthyidae and Centrarchiformes (Percomorphaceae): comparison with recent nuclear gene-based studies and simultaneous analysis,"Gene 549 (1), 46-57 (2014)","Lavoue,S.",02-SEP-2014,"Howella brodiei mitochondrial DNA, complete genome",258,10 Dec 2023,12s.miya,2,175,caccgcggttatacgagagacccaagttgatagacatcggcgtaaagagtggttaagacaaattaaagactaaagccgaagcccctcagagctgttatacgcacccgagagcaagaagttcaatcacgaaagtggctttaccccccccccccctgaacccacgaaagctatgata
Istiophorus albicans,GENBANK,546143982,NC_022478.1,Animalia,Chordata,Actinopterygii,Perciformes,Istiophoridae,Istiophorus,Istiophorus albicans,78,NA,NA,NA,NA,NA,Evolutionary origin of the scombridae (tunas and mackerels): members of a paleogene adaptive radiation with 14 other pelagic fish families,"PLoS ONE 8 (9), E73535 (2013)","Miya,M.",26-SEP-2013,"Istiophorus albicans mitochondrion, complete genome",258,10 Dec 2023,12s.miya,4,169,caccgcggttatacgagaggcccaagttgacagacaacggcgtaaagagtggttaaggaaacccaaaaactaaagccgaacgctctcagagctgttatacgcatccgaaggtatgaagcccaactacgaaagtggctttacatcacccgaacccacgaaagctaagaaa
Kajikia albida,GENBANK,2557040498,OR380545.1,Animalia,Chordata,Actinopterygii,Perciformes,Istiophoridae,Kajikia,Kajikia albida,219,"USA: Atlantic Ocean, Mid-Atlantic",USNM:FISH:451167,NA,NA,NA,Chesapeake Bay Barcode Initiative (CBBI): Fishes of the greater Chesapeake Bay - 12S,Unpublished,"Aguilar,R.",25-OCT-2023,"Kajikia albida voucher USNM:FISH:451167 small subunit ribosomal RNA gene, partial sequence; mitochondrial",258,10 Dec 2023,12s.miya,7,169,caccgcggttatacgagaggcccaagttgacagacaacggcgtaaagagtggttaaggaaacccaaaaactaaagccgaacgctctcagagctgttatacgcatccgaaggtatgaagcccaactacgaaagtggctttacatcacccgaacccacgaaagctaagaaa
Acantholabrus palloni,GENBANK,1189408039,KY815234.1,Animalia,Chordata,Actinopterygii,Perciformes,Labridae,Acantholabrus,Acantholabrus palloni,7633,NA,Personal:R. Hanel:LB158,NA,NA,NA,Mechanosensation is evolutionarily tuned to locomotor mechanics,"Proc. Natl. Acad. Sci. U.S.A. 114 (17), 4459-4464 (2017)","Aiello,B.R.",09-MAY-2017,"Acantholabrus palloni voucher Personal:R. Hanel:LB158 12S ribosomal RNA gene, partial sequence; mitochondrial",258,10 Dec 2023,12s.miya,1,170,caccgcggttatacgaaagacccaagttgataaacaccggcgtaaagagtggttagggtaaactatcaaactaaagccgaacatcttcaaagctgttatacgcacacgaaggacagaagcacaaccacgaaagtggctttaccccacctgaccccacgagagctatggca
