sciNameValid,source,dbid,gbAccession,kingdom,phylum,class,order,family,genus,sciNameOrig,fbSpecCode,country,catalogNumber,institutionCode,decimalLatitude,decimalLongitude,publishedAs,publishedIn,publishedBy,date,notesGenBank,genbankVersion,searchDate,metabarcode,numberHaplotypes,length,nucleotides
Scorpaena porcus,GENBANK,1894451045,MT903908.1,Animalia,Chordata,Actinopterygii,Scorpaeniformes,Scorpaenidae,Scorpaena,Scorpaena porcus,1758,NA,Scorpaena.porcus_3_12S.rRNA_partial,NA,NA,NA,Environmental DNA effectively captures functional diversity of coastal fish communities,Unpublished,"Aglieri,G.",25-AUG-2020,"Scorpaena porcus voucher Scorpaena.porcus_3_12S.rRNA_partial small subunit ribosomal RNA gene, partial sequence; mitochondrial",258,10 Dec 2023,12s.miya,3,164,gcggttatacgagaggcccaagttgatattcttcggcgtaaagagtggttatggaataaattaactaaagccgtaccccttcacagctgttatacgcatatgaagggcagaagccctatcacgaaagtggctttattaaccctgaccccacgaaagctatggca
Scorpaena porcus,GENBANK,1894451047,MT903909.1,Animalia,Chordata,Actinopterygii,Scorpaeniformes,Scorpaenidae,Scorpaena,Scorpaena porcus,1758,NA,Scorpaena.porcus_4_12S.rRNA_partial,NA,NA,NA,Environmental DNA effectively captures functional diversity of coastal fish communities,Unpublished,"Aglieri,G.",25-AUG-2020,"Scorpaena porcus voucher Scorpaena.porcus_4_12S.rRNA_partial small subunit ribosomal RNA gene, partial sequence; mitochondrial",258,10 Dec 2023,12s.miya,1,131,cgttcagagtggttatggaattaaatttaacttaaagccgtaccccttcacagctgttatacgcatatgaagggcagaagccctatcacgaaagtggctttattaaccctgaccccacgaaagctatggca
Scorpaena porcus,GENBANK,1894451048,MT903910.1,Animalia,Chordata,Actinopterygii,Scorpaeniformes,Scorpaenidae,Scorpaena,Scorpaena porcus,1758,NA,Scorpaena.porcus_5_12S.rRNA_partial,NA,NA,NA,Environmental DNA effectively captures functional diversity of coastal fish communities,Unpublished,"Aglieri,G.",25-AUG-2020,"Scorpaena porcus voucher Scorpaena.porcus_5_12S.rRNA_partial small subunit ribosomal RNA gene, partial sequence; mitochondrial",258,10 Dec 2023,12s.miya,1,135,ttcttcggcgtaagagtggttatggaataaattaactaaagccgtaccccttcacagctgttatacgcatatgaagggcagaagccctatcacgaaagtggctttattaaccctgaccccacgaaagctatggca
Scorpaena scrofa,GENBANK,1843818491,MT497799.1,Animalia,Chordata,Actinopterygii,Scorpaeniformes,Scorpaenidae,Scorpaena,Scorpaena scrofa,1759,Portugal: Azores,NA,NA,NA,NA,Building Reference Library for Marine Fish Species of Azores Archipelago and Bio-monitoring via DNA Metabarcoding,Unpublished,"Luz,A.",25-MAY-2020,"Scorpaena scrofa isolate 3199 small subunit ribosomal RNA gene, partial sequence; mitochondrial",258,10 Dec 2023,12s.miya,1,163,ggttatacgagaggcccaagttgataatttccggcgtaaagagtggttatgggataaattaactaaagccgtaccccttcagagctgtcatacgcatatgaaggacagaagcccaaaccacgaaagtggctttattaaccctgaccccacgaaagctatggca
Scorpaena scrofa,GENBANK,1894451049,MT903911.1,Animalia,Chordata,Actinopterygii,Scorpaeniformes,Scorpaenidae,Scorpaena,Scorpaena scrofa,1759,NA,Scorpaena.scrofa_1_12S.rRNA_partial,NA,NA,NA,Environmental DNA effectively captures functional diversity of coastal fish communities,Unpublished,"Aglieri,G.",25-AUG-2020,"Scorpaena scrofa voucher Scorpaena.scrofa_1_12S.rRNA_partial small subunit ribosomal RNA gene, partial sequence; mitochondrial",258,10 Dec 2023,12s.miya,1,164,gcggttatacgagaggcccaagttgataatttccggcgtaaagagtggttatgggataaattaactaaagccgtaccccttcagagctgtcatacgcatatgaaggacagaagcccaaccacgaaagtggctttattaaccctgaccccacgaaagctatggca
Scorpaena scrofa,GENBANK,1894451050,MT903912.1,Animalia,Chordata,Actinopterygii,Scorpaeniformes,Scorpaenidae,Scorpaena,Scorpaena scrofa,1759,NA,Scorpaena.scrofa_2_12S.rRNA_partial,NA,NA,NA,Environmental DNA effectively captures functional diversity of coastal fish communities,Unpublished,"Aglieri,G.",25-AUG-2020,"Scorpaena scrofa voucher Scorpaena.scrofa_2_12S.rRNA_partial small subunit ribosomal RNA gene, partial sequence; mitochondrial",258,10 Dec 2023,12s.miya,1,134,tttccggcgtaagagtggttatgggataaattaactaaagccgtaccccttcagagctgtcatacgcatatgaaggacagaagcccaaccacgaaagtggctttattaaccctgaccccacgaaagctatggca
Helicolenus dactylopterus,GENBANK,1209184448,LC277892.1,Animalia,Chordata,Actinopterygii,Scorpaeniformes,Sebastidae,Helicolenus,Helicolenus dactylopterus,76,NA,CBM:ZF:11811,NA,NA,NA,"Reference data of mitochondrial 12S ribosomal RNA gene, partial sequence for eDNA analyzing",Unpublished,"Miya,M.",21-JUN-2017,"Helicolenus dactylopterus mitochondrial gene for 12S rRNA, partial sequence, specimen_voucher: CBM:ZF:11811",258,10 Dec 2023,12s.miya,3,168,caccgcggctatacgagagacccgagttgataccattcggcgtaaagagtggttatggaaaataaaaactaaagccgcacaccttcaaagctgttatacgcatccgaaggcaagaagaccaaccacgaaggtagctttacaacccctgaccccacgaaagctctggca
Helicolenus dactylopterus,GENBANK,1788585327,MN883181.1,Animalia,Chordata,Actinopterygii,Scorpaeniformes,Sebastidae,Helicolenus,Helicolenus dactylopterus,76,Atlantic Ocean,NA,NA,36.4232,-74.4065,Improved eDNA reference library for U.S. mid-Atlantic fishes,Unpublished,"Stoeckle,M.Y.",04-JAN-2020,"Helicolenus dactylopterus isolate MM09 small subunit ribosomal RNA gene, partial sequence; mitochondrial",258,10 Dec 2023,12s.miya,2,168,caccgcggctatacgagagacccgagttgataccattcggcgtaaagagtggttatggaaaataaaaactaaagccgcacaccttcaaagctgttatacgcacccgaaggcaagaagaccaaccacgaaggtagctttacaacccctgaccccacgaaagctctggca
Sebastes norvegicus,GENBANK,2050584114,MW846223.1,Animalia,Chordata,Actinopterygii,Scorpaeniformes,Sebastidae,Sebastes,Sebastes norvegicus,501,NA,NA,NA,NA,NA,"Complete mitochondrial genomes of two rockfish: Sebastes maliger and Sebastes norvegicus (Scorpaenidae, Scorpaeniformes)","Mitochondrial DNA B Resour 7 (9), 1614-1616 (2022)","Campbell,J.R.",15-JUN-2021,"Sebastes norvegicus mitochondrion, complete genome",258,10 Dec 2023,12s.miya,2,168,caccgcggctatacgagagacccaagttgataccacccggcgtaaagagtggttatggaaaataaagactaaagccgcacaccttcaaagctgttatacgcatccgaaggctagaagatcaaccacgaaggtagctttacaacccctgaccccacgaaagctctggca
Sebastes norvegicus,GENBANK,2333440986,OP863156.1,Animalia,Chordata,Actinopterygii,Scorpaeniformes,Sebastidae,Sebastes,Sebastes norvegicus,501,"Greenland: Greenland Sea/Polar Sea, NNW of Svalbard",Sebastes_norvegicus_P2394775,NA,NA,NA,Distinct latitudinal community patterns of Arctic marine vertebrates along the East Greenlandic coast detected by environmental DNA,Divers Distrib (2022) In press,"Jensen,M.R.",20-DEC-2022,"Sebastes norvegicus voucher Sebastes_norvegicus_P2394775 small subunit ribosomal RNA gene, partial sequence; mitochondrial",258,10 Dec 2023,12s.miya,2,168,caccgcggctatacgagagacccaagttgataccatccggcgtaaagagtggttatggaaaataaagactaaagccgcacaccttcaaagctgttatacgcatccgaaggctagaagatcaaccacgaaggtagctttacaacccctgaccccacgaaagctctggca
Sebastes viviparus,GENBANK,1898139656,MT410865.1,Animalia,Chordata,Actinopterygii,Scorpaeniformes,Sebastidae,Sebastes,Sebastes viviparus,1352,NA,NA,NA,NA,NA,DNAmark Project,Unpublished,"Margaryan,A.",06-SEP-2020,"Sebastes viviparus isolate DM436 mitochondrion, complete genome",258,10 Dec 2023,12s.miya,4,168,caccgcggctatacgagagacccaagttgataccacccggcgtaaagagtggttatggaaaataaagactaaagccgcacaccttcaaagctgttatacgcatccgaaggctagaagatcaaccacgaaggtagctttacaacccctgaccccacgaaagctctggca
Chelidonichthys cuculus,GENBANK,2018537135,MW818296.1,Animalia,Chordata,Actinopterygii,Scorpaeniformes,Triglidae,Chelidonichthys,Chelidonichthys cuculus,44,United Kingdom: English Channel,NA,NA,50.25,-4.2172,"A generalised, dynamic DNA reference library pipeline for metabarcoding of fishes",Unpublished,"Collins,R.A.",31-MAR-2021,"Chelidonichthys cuculus isolate SEA0321 small subunit ribosomal RNA gene, partial sequence; mitochondrial",258,10 Dec 2023,12s.miya,6,169,caccgcggttatacgagaggcccaagttgacagtcaccggcgtaaagagtggttaaagaatgattaaaactaaagccgaacaccttcaaggcagttatacgcacccgaaggttagaagcccaactacgaaagtggctttatctttcctgaacccacgagagctacggca
Chelidonichthys lastoviza,GENBANK,2018537062,MW818223.1,Animalia,Chordata,Actinopterygii,Scorpaeniformes,Triglidae,Chelidonichthys,Trigloporus lastoviza,5081,United Kingdom: English Channel,NA,NA,50.25,-4.2172,"A generalised, dynamic DNA reference library pipeline for metabarcoding of fishes",Unpublished,"Collins,R.A.",31-MAR-2021,"Trigloporus lastoviza isolate SEA0450 small subunit ribosomal RNA gene, partial sequence; mitochondrial",258,10 Dec 2023,12s.miya,2,169,caccgcggttatacgagaggcccaagttgacagtcaccggcgtaaagagtggttaaagaatgattaaaactaaagccgaacaccttcaaggcagttatacgcacccgaaggttagaagcccaactacgaaagtggctttatctttcctgaacccacgagagctacggca
Chelidonichthys lastoviza,GENBANK,2018537078,MW818239.1,Animalia,Chordata,Actinopterygii,Scorpaeniformes,Triglidae,Chelidonichthys,Trigloporus lastoviza,5081,United Kingdom: English Channel,NA,NA,50.25,-4.2172,"A generalised, dynamic DNA reference library pipeline for metabarcoding of fishes",Unpublished,"Collins,R.A.",31-MAR-2021,"Trigloporus lastoviza isolate SEA0311 small subunit ribosomal RNA gene, partial sequence; mitochondrial",258,10 Dec 2023,12s.miya,1,169,caccgcggttatacgagaggcccaagttgacggtcaccggcgtaaagagtggttaaagaatgattaaaactaaagccgaacaccttcaaggcagttatacgcacccgaaggttagaagcccaactacgaaagtggctttatctttcctgaacccacgagagctacggca
Chelidonichthys lucerna,GENBANK,2188144269,OM509546.1,Animalia,Chordata,Actinopterygii,Scorpaeniformes,Triglidae,Chelidonichthys,Chelidonichthys lucerna,1366,Atlantic Ocean: English Channel (France),NA,NA,NA,NA,In prep : Coastal rocky reef fish monitoring in the context of the Marine Strategy Framework Directive: environmental DNA metabarcoding complements underwater visual census,Unpublished,"Rey,A.",09-FEB-2022,"Chelidonichthys lucerna isolate F63 small subunit ribosomal RNA gene, partial sequence; mitochondrial",258,10 Dec 2023,12s.miya,1,166,gcggttatacgagagacccaagttgacagtcaccggcgtaaagagtggttaaagaatgattaaaactaaagccgaacaccttcaaggcagttatacgcacccgaaggttagaagcccaactacgaaagtggctttatctttcctgaacccacgagagctacggcac
Chelidonichthys lucerna,GENBANK,2208847195,ON000326.1,Animalia,Chordata,Actinopterygii,Scorpaeniformes,Triglidae,Chelidonichthys,Chelidonichthys lucerna,1366,NA,NA,NA,NA,NA,Assessing accuracy and completeness of GenBank for eDNA metabarcoding: towards a reliable marine fish reference database,Unpublished,"Claver,C.",29-NOV-2022,"Chelidonichthys lucerna isolate BARC-011 small subunit ribosomal RNA gene, partial sequence; mitochondrial",258,10 Dec 2023,12s.miya,5,169,caccgcggttatacgagaggcccaagttgacagtcaccggcgtaaagagtggttaaagaatgattaaaactaaagccgaacaccttcaaggcagttatacgcacccgaaggttagaagcccaactacgaaagtggctttatctttcctgaacccacgagagctacggca
Eutrigla gurnardus,GENBANK,1799624560,MN122888.1,Animalia,Chordata,Actinopterygii,Scorpaeniformes,Triglidae,Eutrigla,Eutrigla gurnardus,68,NA,NA,NA,NA,NA,DNAmark project,Unpublished,"Margaryan,A.",27-JAN-2020,"Eutrigla gurnardus mitochondrion, complete genome",258,10 Dec 2023,12s.miya,5,169,caccgcggttatacgagaggcccaagttgacagtcaccggcgtaaagagtggttaaagaatgattaaaactaaagccgaacaccttcaaggcagttatacgcacccgaaggttagaagcccaactacgaaagtggctttatctttcctgaacccacgagagctacggca
Eutrigla gurnardus,GENBANK,2028741867,MW995349.1,Animalia,Chordata,Actinopterygii,Scorpaeniformes,Triglidae,Eutrigla,Eutrigla gurnardus,68,Denmark,P791529,NA,NA,NA,Short-term temporal variation of coastal marine eDNA,Environ DNA (2022) In press,"Jensen,M.R.",01-JAN-2022,"Eutrigla gurnardus voucher P791529 small subunit ribosomal RNA gene, partial sequence; mitochondrial",258,10 Dec 2023,12s.miya,1,166,gcggttatacgagaggcccaagttgacagtcaccggcgtaaagagtggttaaagaatgattaaaactaaagccgaacaccttcaaggcagttatacgcacccgaaggttagaagcccaactacgaaagtggctttatctttcctgaacccacgagagctacggcac
Ameiurus melas,GENBANK,2386959146,NC_068674.1,Animalia,Chordata,Actinopterygii,Siluriformes,Ictaluridae,Ameiurus,Ameiurus melas,291,USA,NEFC_F19-370,NA,NA,NA,Freshwater Fish Mitochondrial Genome Project,Unpublished,"Maloy,A.P.",05-DEC-2022,"Ameiurus melas voucher NEFC_F19-370 mitochondrion, complete genome",258,10 Dec 2023,12s.miya,5,172,caccgcggttatacgaaagaccctagttgctagccacggcgtaaagggtggttaaggacaacaacaaataaagctaaagatcccctaagccgtcatacgcattccgggggcacgaagccctaacacgaaagtagctttaaaaaatatacctgaccccacgaaagctaagaaa
Ameiurus nebulosus,GENBANK,2325477812,OM736814.1,Animalia,Chordata,Actinopterygii,Siluriformes,Ictaluridae,Ameiurus,Ameiurus nebulosus,3022,USA,NEFC_F19-444,NA,NA,NA,Freshwater Fish Mitochondrial Genome Project,Unpublished,"Maloy,A.P.",09-NOV-2022,"Ameiurus nebulosus voucher NEFC_F19-444 mitochondrion, complete genome",258,10 Dec 2023,12s.miya,8,172,caccgcggttatacgaaagaccctagttgctagccacggcgtaaagggtggttaaggacaacaacaaataaagctaaagatcccctaagccgtcatacgcattccgggggcacgaagccctaacacgaaagtagctttaaaaaatatacctgaccccacgaaagctaagaaa
Ameiurus nebulosus,GENBANK,985563492,LC104407.1,Animalia,Chordata,Actinopterygii,Siluriformes,Ictaluridae,Ameiurus,Ameiurus nebulosus,3022,NA,CBM:ZF:15821,NA,NA,NA,"Reference data of mitochondrial gene for 12S ribosomal RNA, partial sequence of fishes for eDNA analyzing",Unpublished,"Miya,M.",03-FEB-2016,"Ameiurus nebulosus mitochondrial gene for 12S rRNA, partial sequence, specimen_voucher: CBM:ZF:15821",258,10 Dec 2023,12s.miya,15,172,caccgcggttatacgaaaggccctagttgctagccacggcgtaaagggtggttaaggacaacaacaaataaagctaaagatcccctaagccgtcatacgcattccgggggcacgaagccctaacacgaaagtagctttaaaaaatatacctgaccccacgaaagctaagaaa
Ictalurus punctatus,GENBANK,1276391554,MF621716.1,Animalia,Chordata,Actinopterygii,Siluriformes,Ictaluridae,Ictalurus,Ictalurus punctatus,290,USA: South Carolina,NA,NA,NA,NA,Fish mitochondrial genome sequencing: expanding genetic resources to support species detection and biodiversity monitoring using environmental DNA,"Conserv Genet Resour 12 (3), 433-446 (2020)","Schroeter,J.C.",18-NOV-2017,"Ictalurus punctatus strain NEFC_F16-263 mitochondrion, complete genome",258,10 Dec 2023,12s.miya,4,170,caccgcggttatacgaaagaccctagttgctagccacggcgtaaagggtggttaaggacaacaatgaataaagctaaagaccccctgggccgtcatacgcatttcgggggcacgaaaccctaacacgaaagtagctttaaaacacacctgaccccacgaaagctaagaaa
Ictalurus punctatus,GENBANK,2325478036,OM736830.1,Animalia,Chordata,Actinopterygii,Siluriformes,Ictaluridae,Ictalurus,Ictalurus punctatus,290,USA,NEFC_F19-337,NA,NA,NA,Freshwater Fish Mitochondrial Genome Project,Unpublished,"Maloy,A.P.",09-NOV-2022,"Ictalurus punctatus voucher NEFC_F19-337 mitochondrion, complete genome",258,10 Dec 2023,12s.miya,18,171,caccgcggttatacgaaagaccctagttgctagccacggcgtaaagggtggttaaggacaacaatgaataaagctaaagaccccctgggccgtcatacgcatttcgggggcacgaaaccctaacacgaaagtagctttaaaaacacacctgaccccacgaaagctaagaaa
Silurus glanis,GENBANK,2120245552,MT483611.1,Animalia,Chordata,Actinopterygii,Siluriformes,Siluridae,Silurus,Silurus glanis,289,NA,NA,NA,NA,NA,DNAmark Project,Unpublished,"Langkjaer,E.",30-OCT-2021,"Silurus glanis isolate DM853 mitochondrion, complete genome",258,10 Dec 2023,12s.miya,3,170,caccgcggttatacgaaagaccctagttaatagccacggcgtaaagggtggttaaggaatataacaaataaagctaaagaccctctaagccgttatacgcactccgaggacacgaagcccaaacacgaaagtagctttaaacccctcctgactccacaaaagctaagaaa
Silurus glanis,GENBANK,299823648,NC_014261.1,Animalia,Chordata,Actinopterygii,Siluriformes,Siluridae,Silurus,Silurus glanis,289,Greece:Kastoria lake,NA,NA,NA,NA,"The mitochondrial genome of the European catfish Silurus glanis (Siluriformes, Siluridae)","J Biol Res (Thessalon) 15, 25-35 (2011)","Vittas,S.",29-JUN-2010,"Silurus glanis mitochondrion, complete genome",258,10 Dec 2023,12s.miya,2,170,caccgcggttatacgaaagaccctagttaatagccacggcgtaaagggtggttaaggaatataacaaataaagctaaagaccctttaagccgttatacgcactccgaggacacgaagcccaaacacgaaagtagctttaaacccctcctgactccactaaagctaagaaa
Melamphaes suborbitalis,GENBANK,2491776973,OQ846168.1,Animalia,Chordata,Actinopterygii,Stephanoberyciformes,Melamphaidae,Melamphaes,Melamphaes suborbitalis,17180,Pacific Ocean,#10-164,NA,32.0667,-137.9,Improving metabarcoding taxonomic assignment: A case study of fishes in a large marine ecosystem,"Mol Ecol Resour 21 (7), 2546-2564 (2021)","Gold,Z.",24-APR-2023,"Melamphaes suborbitalis voucher #10-164 small subunit ribosomal RNA gene, partial sequence; mitochondrial",258,10 Dec 2023,12s.miya,1,173,gaccgcggttagacgagcgacccaagctgattgcctccggcgtaaagcgtggttaagggataaaaaataactaaagccgaatgccctcaaggctgttatacgcatccgaaggtacgaagccccatcacgaaagtggctttaattctccccctgactccacgaaagctacgcaa
Scopelogadus beanii,GENBANK,2333441054,OP863188.1,Animalia,Chordata,Actinopterygii,Stephanoberyciformes,Melamphaidae,Scopelogadus,Scopelogadus beanii,9058,Greenland: Davis Strait,Scopelogadus_beanii_P412392,NA,NA,NA,Distinct latitudinal community patterns of Arctic marine vertebrates along the East Greenlandic coast detected by environmental DNA,Divers Distrib (2022) In press,"Jensen,M.R.",20-DEC-2022,"Scopelogadus beanii voucher Scopelogadus_beanii_P412392 small subunit ribosomal RNA gene, partial sequence; mitochondrial",258,10 Dec 2023,12s.miya,1,171,caccgcggttatacgagcagcccaagctgataattttcggcgtaaagagtggttaagggctctaataaactaaagccgaacgccctcaaggctgtcatacgcacccgaaggtacgaagcacccctacgaaagtggctttaaaccccgcctgaccccacgaaagctacgcaa
Scopelogadus beanii,GENBANK,2497635824,OQ883796.1,Animalia,Chordata,Actinopterygii,Stephanoberyciformes,Melamphaidae,Scopelogadus,Scopelogadus beanii,9058,NA,WHOI:OTZ_34,NA,39.20047,-71.14308,Mesopelagic fish diversity and diel vertical migration in the Northwest Atlantic Slope Sea,Unpublished,"Govindarajan,A.",28-NOV-2023,"Scopelogadus beanii isolate HB1805_MWT5_96 small subunit ribosomal RNA gene, partial sequence; mitochondrial",258,10 Dec 2023,12s.miya,1,171,caccgcggttatacgagcagcccaagctgataattttcggcgtaaagagtggttaagggctcaaataaactaaagccgaacgccctcaaggctgtcatacgcacccgaaggtacgaagcacccctacgaaagtggctttaaaccccgcctgaccccacgaaagctacgcaa
Scopelogadus mizolepis,GENBANK,16267076,AP002934.1,Animalia,Chordata,Actinopterygii,Stephanoberyciformes,Melamphaidae,Scopelogadus,Scopelogadus mizolepis,10284,NA,NA,NA,NA,NA,Mitogenomic exploration of higher teleostean phylogenies: a case study for moderate-scale evolutionary genomics with 38 newly determined complete mitochondrial DNA sequences,"Mol. Biol. Evol. 18 (11), 1993-2009 (2001)","Miya,M.",19-OCT-2001,"Scopelogadus mizolepis mitochondrial DNA, complete genome, except for D-loop",258,10 Dec 2023,12s.miya,1,171,caccgcggttatacgagcagcccaagctgataaatatcggcgtaaagagtggttaaggagtaaaacaaaataaagccgaacgccctcaaggctgttatacgcatccgaaggtacgaagcacccctacgaaagtaactttaaaccccgcctgaccccacgaaagctacgaaa
Scopelogadus mizolepis,GENBANK,2497635825,OQ883797.1,Animalia,Chordata,Actinopterygii,Stephanoberyciformes,Melamphaidae,Scopelogadus,Scopelogadus mizolepis,10284,NA,WHOI:OTZ_35,NA,39.20047,-71.14308,Mesopelagic fish diversity and diel vertical migration in the Northwest Atlantic Slope Sea,Unpublished,"Govindarajan,A.",28-NOV-2023,"Scopelogadus mizolepis isolate HB1805_MWT5_99 small subunit ribosomal RNA gene, partial sequence; mitochondrial",258,10 Dec 2023,12s.miya,1,171,caccgcggttatacgagcagcccaagctgataattttcggcgtaaagagtggttaagggctctaataaactaaagccgaacgccctcaaggctgtcatacgcacccgaaggtacgaagcacccctacgaaagtggctttaaaccccgcctgaccccacgaaagctacgcaa
Bonapartia pedaliota,GENBANK,985566984,LC091651.1,Animalia,Chordata,Actinopterygii,Stomiiformes,Gonostomatidae,Bonapartia,Bonapartia pedaliota,9965,NA,NA,NA,NA,NA,Reference data for MiFish metabarcoding analysis,Unpublished,"Miya,M.",03-FEB-2016,"Bonapartia pedaliota mitochondrial gene for 12S rRNA, partial sequence, bio_material: CBM(Chiba Museum) DNA No. 2015-131",258,10 Dec 2023,12s.miya,1,166,caccgcggttatacgagaggctcaaattgacaggcgccggcgtaaagagtggtcaaggattcaatgtaataaggccgtacaccccccccgctgttatacgcccccggagaaatgaagcccccacgaaagtagccttaccacacctgaacccacgacaactaagaac
Bonapartia pedaliota,GENBANK,985567012,LC091679.1,Animalia,Chordata,Actinopterygii,Stomiiformes,Gonostomatidae,Bonapartia,Bonapartia pedaliota,9965,NA,CBM:ZF:9988,NA,NA,NA,Reference data for MiFish metabarcoding analysis,Unpublished,"Miya,M.",03-FEB-2016,"Bonapartia pedaliota mitochondrial gene for 12S rRNA, partial sequence, specimen_voucher: CBM:ZF:9988",258,10 Dec 2023,12s.miya,1,167,caccgcggttatacgagaggctcaaattgacaggcgccggcgtaaagagtggtcaaggattcaatgtaataaggccgtacacccccccccgctgttatacgcccccggagaaatgaagcccccacgaaagtagccttaccacacctgagcccacgacaactaaaaac
Cyclothone braueri,GENBANK,1096114357,LC193323.1,Animalia,Chordata,Actinopterygii,Stomiiformes,Gonostomatidae,Cyclothone,Cyclothone braueri,1774,NA,CBM:ZF:16650,NA,NA,NA,"Reference data of mitochondrial 12S ribosomal RNA gene, partial sequence for eDNA analyzing",Unpublished,"Miya,M.",01-NOV-2016,"Cyclothone braueri mitochondrial gene for 12S rRNA, partial sequence, specimen_voucher: CBM:ZF:16650",258,10 Dec 2023,12s.miya,3,166,taccgcggttacacgaaaagccctagccgttaggccccggcgcaaagggtggttagagaatatccacataaagtcaaacttaacccccgctgtggtacgcaagcccgtaagcaaagacctcgacgaaagtaactttatcccgcttgaagccacaaaagctagggta
Cyclothone braueri,GENBANK,985567010,LC091677.1,Animalia,Chordata,Actinopterygii,Stomiiformes,Gonostomatidae,Cyclothone,Cyclothone braueri,1774,NA,CBM:ZF:7989,NA,NA,NA,Reference data for MiFish metabarcoding analysis,Unpublished,"Miya,M.",03-FEB-2016,"Cyclothone braueri mitochondrial gene for 12S rRNA, partial sequence, specimen_voucher: CBM:ZF:7989",258,10 Dec 2023,12s.miya,1,166,taccgcggttacacgaaaagccctagccgttaggccccggcgcaaagggtggttagagaatatccacataaagtcaaacttaacccccgctgtggtacgcaagctcgtaagcaaagacctcgacgaaagtaactttatcccgcttgaagccacaaaagctagggta
Cyclothone microdon,GENBANK,2497635803,OQ883776.1,Animalia,Chordata,Actinopterygii,Stomiiformes,Gonostomatidae,Cyclothone,Cyclothone microdon,1775,NA,WHOI:OTZ_53,NA,25.29077,-77.3084,Mesopelagic fish diversity and diel vertical migration in the Northwest Atlantic Slope Sea,Unpublished,"Govindarajan,A.",28-NOV-2023,"Cyclothone microdon isolate AL1903_MW2_33 small subunit ribosomal RNA gene, partial sequence; mitochondrial",258,10 Dec 2023,12s.miya,3,167,taccgcggttatacgaaaagccccagctgataggcctccggcacaaagggtggttaggagaattacaacataaagccaaactcccccccggctgtgatacgcagcccaccagcaaagaccactacaaaagtagctttatattccctgaagccacgaaagctagggca
Cyclothone obscura,GENBANK,985566974,LC091641.1,Animalia,Chordata,Actinopterygii,Stomiiformes,Gonostomatidae,Cyclothone,Cyclothone obscura,9983,NA,NA,NA,NA,NA,Reference data for MiFish metabarcoding analysis,Unpublished,"Miya,M.",03-FEB-2016,"Cyclothone obscura mitochondrial gene for 12S rRNA, partial sequence, bio_material: CBM(Chiba Museum) DNA No. 2000-044",258,10 Dec 2023,12s.miya,2,167,taccgcggttacacgaaaagccccagctgataggccccggcacaaagggtggttaaggaaaccttttaaagccaaactctacccccgcccgctgtgatacgcagctcgcaagtaaagacctagacgaaagtaactttactttgcctgaagccacaaaagctagggca
Argyropelecus hemigymnus,GENBANK,2497635867,OQ883839.1,Animalia,Chordata,Actinopterygii,Stomiiformes,Sternoptychidae,Argyropelecus,Argyropelecus hemigymnus,6968,NA,WHOI:OTZ_81,NA,39.5759,-70.8789,Mesopelagic fish diversity and diel vertical migration in the Northwest Atlantic Slope Sea,Unpublished,"Govindarajan,A.",28-NOV-2023,"Argyropelecus hemigymnus isolate AR43_MOC4_net3_101 small subunit ribosomal RNA gene, partial sequence; mitochondrial",258,10 Dec 2023,12s.miya,2,171,taccgcggttagacgtttaggcccaggttgatagatttcggcgtaaagagtggttaagtgtatggtgggctaaggtcgaacgtccccctggctgtgatacgcatttttggaggagtgaagctcgtatgcgaaggtagccttatgtgccttgaatccacgaaagctggggaa
Argyropelecus olfersii,GENBANK,2333441060,OP863191.1,Animalia,Chordata,Actinopterygii,Stomiiformes,Sternoptychidae,Argyropelecus,Argyropelecus olfersii,5097,Greenland: Davis Strait,Argyropelecus_olfersii_P2014834,NA,NA,NA,Distinct latitudinal community patterns of Arctic marine vertebrates along the East Greenlandic coast detected by environmental DNA,Divers Distrib (2022) In press,"Jensen,M.R.",20-DEC-2022,"Argyropelecus olfersii voucher Argyropelecus_olfersii_P2014834 small subunit ribosomal RNA gene, partial sequence; mitochondrial",258,10 Dec 2023,12s.miya,1,169,taccgcggttagacgttagaccctagttgatgaatttcggcgtaaagtgtggtctaggtttaggtgtattaaagttgaacactccctttgctgtgatatgcttttggaggggtgaagcccgcatacgaaagtagctttagtctttcctgaacccacgacagctgaggaa
Argyropelecus olfersii,GENBANK,2497635880,OQ883852.1,Animalia,Chordata,Actinopterygii,Stomiiformes,Sternoptychidae,Argyropelecus,Argyropelecus olfersii,5097,NA,WHOI:OTZ_94,NA,49.111667,-14.747306,Mesopelagic fish diversity and diel vertical migration in the Northwest Atlantic Slope Sea,Unpublished,"Govindarajan,A.",28-NOV-2023,"Argyropelecus olfersii isolate SG2105_MWT5_70 small subunit ribosomal RNA gene, partial sequence; mitochondrial",258,10 Dec 2023,12s.miya,2,169,taccgcggttagacgttagaccctagttgatgaatttcggcgtaaagtgtggtctaggtttaggtgtattaaagttgaacactccctttgctgtgatatgcttttggaggggtgaagcccgcatacgaaagtagctttagtctttcctgaacccacgacagctaaggaa
Maurolicus muelleri,GENBANK,985567016,LC091683.1,Animalia,Chordata,Actinopterygii,Stomiiformes,Sternoptychidae,Maurolicus,Maurolicus muelleri,754,NA,NA,NA,NA,NA,Reference data for MiFish metabarcoding analysis,Unpublished,"Miya,M.",03-FEB-2016,"Maurolicus muelleri mitochondrial gene for 12S rRNA, partial sequence, bio_material: CBM(Chiba Museum) DNA No. 2015-116",258,10 Dec 2023,12s.miya,3,169,caccgcggttagacgagagacccaagttgacatcaaacggcgtaaagagtggttaagaaccttccaaactaaagctaaaccccctcctggccgttatacgcatccgaaagggtgagacaccactacaaaagtagctttataattacctgactccacgacagttaagaaa
Sternoptyx diaphana,GENBANK,1913933953,MT588184.1,Animalia,Chordata,Actinopterygii,Stomiiformes,Sternoptychidae,Sternoptyx,Sternoptyx diaphana,7389,Canada,NA,NA,NA,NA,"A new gene order in the mitochondrial genome of the deep-sea diaphanous hatchet fish Sternoptyx diaphana Hermann, 1781 (Stomiiformes: Sternoptychidae)","Mitochondrial DNA B Resour 5 (3), 2859-2861 (2020)","Arrondo,N.V.",12-OCT-2020,"Sternoptyx diaphana mitochondrion, complete genome",258,10 Dec 2023,12s.miya,2,169,taccgcggttagacaggaggtccaagttgataagtatcggtgtagagtgtggttaggggttgtggaaactaaagttgaacatctctttggctgttatacgcacttggaagatggaagcacaattacgaaggtggctttatttagacctgagtccacgacagtcagggaa
Sternoptyx diaphana,GENBANK,2318877577,LC732540.1,Animalia,Chordata,Actinopterygii,Stomiiformes,Sternoptychidae,Sternoptyx,Sternoptyx diaphana,7389,Pacific Ocean:South Pacific Ocean,CBM:ZF:14684,NA,NA,NA,Reference data for MiFish metabarcoding analysis,Unpublished,"Sado,T.",18-OCT-2022,"Sternoptyx diaphana CBM:ZF:14684 mitochondrial gene for 12S rRNA, partial sequence",258,10 Dec 2023,12s.miya,6,169,taccgcggttagacaggaggtccaagttgataagtatcggtgtagagtgtggttaggggttgtggcaactaaagttgaacatctctttggctgttatacgcacttggaagatggaagcacaattacgaaggtagctttatttagacctgagtccacgatagtcagggaa
