sciNameValid,source,dbid,gbAccession,kingdom,phylum,class,order,family,genus,sciNameOrig,fbSpecCode,country,catalogNumber,institutionCode,decimalLatitude,decimalLongitude,publishedAs,publishedIn,publishedBy,date,notesGenBank,genbankVersion,searchDate,metabarcode,numberHaplotypes,length,nucleotides
Acipenser ruthenus,GENBANK,47118037,AY544140.1,Animalia,Chordata,Actinopterygii,Acipenseriformes,Acipenseridae,Acipenser,Acipenser ruthenus,4604,NA,NA,NA,NA,NA,Phylogenetic Relationships and Intraindividual Variation of the Nuclear 18S rRNA Gene in the Order Acipenseriformes,Unpublished,"Krieger,J.",30-DEC-2006,"Acipenser ruthenus 12S ribosomal RNA gene, partial sequence; mitochondrial",258,10 Dec 2023,12s.miya,6,180,caccgcggttatacgagaggccccaactgatagtccacggcgtaaagcgtgattaaaggatgcccattatactagagccaaaagccccctaagctgtcatacgcacctgaaggcccgaagcccaaccacgaaggtagctctacccaacaaggaccccttgaacccacgacaactgagaca
Acipenser sturio,GENBANK,835387548,KP997216.1,Animalia,Chordata,Actinopterygii,Acipenseriformes,Acipenseridae,Acipenser,Acipenser sturio,2066,France: Gironde,NA,NA,NA,NA,"Complete mitochondrial genome sequences of Atlantic sturgeon, Acipenser oxyrinchus oxyrinchus, Gulf sturgeon, A. o. desotoi and European sturgeon A. sturio (Acipenseriformes: Acipenseridae) obtained through next generation sequencing","Mitochondrial DNA, 1-3 (2015) In press","Popovic,D.",22-JUN-2015,"Acipenser sturio mitochondrion, complete genome",258,10 Dec 2023,12s.miya,2,180,caccgcggttatacgagaggccccaactgatagtccacggcgtaaagcgtgattaaaggatgtctactacactagagccaaaagccccctaagctgtcatacgcacctgaaggcccgaagcccaaccacgaaagtagctctacctaacgaggaccccttgaacccacgacaactgagaca
Anguilla anguilla,GENBANK,597440506,KJ564228.1,Animalia,Chordata,Actinopterygii,Anguilliformes,Anguillidae,Anguilla,Anguilla anguilla,35,NA,NA,NA,NA,NA,Speciation and demographic history of Atlantic eels (Anguilla anguilla and A. rostrata) revealed by mitogenome sequencing,"Heredity (Edinb) 113 (5), 432-442 (2014)","Jacobsen,M.W.",26-MAR-2014,"Anguilla anguilla isolate RH_G_4 mitochondrion, complete genome",258,10 Dec 2023,12s.miya,62,171,caccgcggttatacgaggggctcaaattgatattacacggcgtaaagcgtgattaaaaaacaaaaaaactaaagccaaacacttcccaagctgtcatacgctaccggaacataaacgaagccctataacgaaagtagctttaacacctttgaactcacgacagttgaggaa
Anguilla anguilla,GENBANK,597440870,KJ564254.1,Animalia,Chordata,Actinopterygii,Anguilliformes,Anguillidae,Anguilla,Anguilla anguilla,35,NA,NA,NA,NA,NA,Speciation and demographic history of Atlantic eels (Anguilla anguilla and A. rostrata) revealed by mitogenome sequencing,"Heredity (Edinb) 113 (5), 432-442 (2014)","Jacobsen,M.W.",26-MAR-2014,"Anguilla anguilla isolate LE_G_10 mitochondrion, complete genome",258,10 Dec 2023,12s.miya,1,171,caccgcggttatacgaggggctcaaattgatactacacggcgtaaagcgtgattaaaaaacaaaaaaactaaagccaaacacttcccaagctgtcatacgctaccggaacataaacgaagccctataacgaaagtagctttaacacctttgaactcacgacagttgaggaa
Anguilla anguilla,GENBANK,597441066,KJ564268.1,Animalia,Chordata,Actinopterygii,Anguilliformes,Anguillidae,Anguilla,Anguilla anguilla,35,NA,NA,NA,NA,NA,Speciation and demographic history of Atlantic eels (Anguilla anguilla and A. rostrata) revealed by mitogenome sequencing,"Heredity (Edinb) 113 (5), 432-442 (2014)","Jacobsen,M.W.",26-MAR-2014,"Anguilla anguilla isolate MO_G_21 mitochondrion, complete genome",258,10 Dec 2023,12s.miya,1,171,caccgcggttatacgaggggctcaaattgatatcacacggcgtaaagcgtgattaaaaaacaaaaaaactaaagccaaacacttcccaagctgtcatacgctaccggaacataaacgaagccctataacgaaagtagctttaacacctttgaactcacgacagttgaggaa
Conger conger,GENBANK,2583636184,OY741333.1,Animalia,Chordata,Actinopterygii,Anguilliformes,Congridae,Conger,Conger conger,301,NA,NA,NA,NA,NA,Direct Submission,"Submitted (28-SEP-2023) WELLCOME SANGER INSTITUTE, Tree of Life, Wellcome Genome Campus, Hinxton CB10 1SA, United Kingdom",NA,28-SEP-2023,"Conger conger genome assembly, organelle: mitochondrion",258,10 Dec 2023,12s.miya,4,171,caccgcggttatacgtatgactcaaattgatatctctcggcgtaaagcgtgattagagaaaaaagaaaactaaagaagaacagcttccatgccgtataaagcttacaaaaacctgaaaaacaataacgaaagtaactttaaacattacttgaattcacgaccgtaaagaaa
Nessorhamphus ingolfianus,GENBANK,1096114213,LC193179.1,Animalia,Chordata,Actinopterygii,Anguilliformes,Derichthyidae,Nessorhamphus,Nessorhamphus ingolfianus,9100,NA,CBM:ZF:16465,NA,NA,NA,"Reference data of mitochondrial 12S ribosomal RNA gene, partial sequence for eDNA analyzing",Unpublished,"Miya,M.",01-NOV-2016,"Nessorhamphus ingolfianus mitochondrial gene for 12S rRNA, partial sequence, specimen_voucher: CBM:ZF:16465",258,10 Dec 2023,12s.miya,3,169,caccgcggttatacgaggggctcaaattgatatccttcggcgtaaagtgtgattagagaacaataaaaactaaagctaaacacctcctgagctgtcatacgctaacggagacagaaaccccacaacgaaagtagctttaacaactcttgaactcacgaccattaagaaa
Nessorhamphus ingolfianus,GENBANK,405779026,JX242911.1,Animalia,Chordata,Actinopterygii,Anguilliformes,Derichthyidae,Nessorhamphus,Nessorhamphus ingolfianus,9100,NA,MCZ 158724,NA,NA,NA,"Phylogeny of moray eels (Anguilliformes: Muraenidae), with a revised classification of true eels (Teleostei: Elopomorpha: Anguilliformes)","Mitochondrial DNA 24 (1), 55-66 (2013)","Tang,K.L.",20-SEP-2012,"Nessorhamphus ingolfianus 12S ribosomal RNA subunit gene, partial sequence; mitochondrial",258,10 Dec 2023,12s.miya,4,169,caccgcggttatacgaggggctcaaattgatatccttcggcgtaaagtgtgattagagaacaataaaaactaaagctaaacaccccctaagctgtcatacgctaacggaaacagaggccccacaacgaaagtggctttaataactcttgaactcacgaccattaagaaa
Muraena helena,GENBANK,223674764,EU921683.1,Animalia,Chordata,Actinopterygii,Anguilliformes,Muraenidae,Muraena,Muraena helena,1729,Atlantic Ocean,NA,NA,NA,NA,Phylogenetic relationships of Gymnothorax bacalladoi Bohlke and Brito (1987) a poorly known moray of the Macaronesian islands,"Mol. Phylogenet. Evol. 52 (1), 252-256 (2009)","Almada,V.C.",25-MAY-2009,"Muraena helena haplotype 1 12S ribosomal RNA gene, partial sequence; mitochondrial",258,10 Dec 2023,12s.miya,4,169,aaccgcggttatacgagaggcccaaattgacgcaccacggcgtaaagtgtgattagagacaaacaagaactagagccgaacgccccttatgctgtcatacgctacgggggacacgaagcccgacaacgaaagtggccctataaaccttgaactcacgacagctaggata
Avocettina infans,GENBANK,1918447694,LC579096.1,Animalia,Chordata,Actinopterygii,Anguilliformes,Nemichthyidae,Avocettina,Avocettina infans,5099,Pacific Ocean:South Pacific Ocean,CBM:ZF:20193,NA,NA,NA,Reference data for MiFish metabarcoding analysis,Unpublished,"Miya,M.",23-OCT-2020,"Avocettina infans CBM:ZF:20193 mitochondrial gene for 12S rRNA, partial sequence",258,10 Dec 2023,12s.miya,3,170,caccgcggttatacgaggggctcaaattgatattgtacggcgtaaagagtgattagaaaaatgaatagactaaagccgaacacccactgagctgtcatacgctactgagcgaaatgaagccccgcaacgaaagtagctttaataactttgaattcacggaagttagggaa
Avocettina infans,GENBANK,332518812,NC_013624.2,Animalia,Chordata,Actinopterygii,Anguilliformes,Nemichthyidae,Avocettina,Avocettina infans,5099,NA,NSMT:P-68041,NA,NA,NA,Deep-ocean origin of the freshwater eels,"Biol. Lett. 6 (3), 363-366 (2010)","Inoue,J.G.",14-DEC-2009,"Avocettina infans mitochondrion, complete genome",258,10 Dec 2023,12s.miya,2,171,caccgcggttatacgaggggctcaaattgatattgtacggcgtaaagagtgattagaaaaaatggatagactaaagccgaacatcccctgagctgtcatacgctactgagcgaaatgaagccccgcaacgaaagtagctttaataactttgaactcacgagagttaaggaa
Avocettina infans,GENBANK,985564886,LC020905.1,Animalia,Chordata,Actinopterygii,Anguilliformes,Nemichthyidae,Avocettina,Avocettina infans,5099,NA,HUMZ:222572,NA,NA,NA,"mitochondrial gene for 12S ribosomal RNA, partial sequence of fishes",Unpublished,"Miya,M.",03-FEB-2016,"Avocettina infans mitochondrial gene for 12S rRNA, partial sequence, specimen_voucher: HUMZ:222572",258,10 Dec 2023,12s.miya,2,171,caccgcggttatacgaggggctcaaattgatattgtacggcgtaaagagtgattagaaaaaatgaataaactaaagccgaacatcccctgagctgtcatacgctactgagcgaaatgaagccccgcaacgaaagtagctttaataactttgaactcacgagagttaaggaa
Nemichthys scolopaceus,GENBANK,13928320,AB049989.1,Animalia,Chordata,Actinopterygii,Anguilliformes,Nemichthyidae,Nemichthys,Nemichthys scolopaceus,2660,NA,NA,NA,NA,NA,Complete mitochondrial DNA sequence of Conger myriaster (Teleostei: Anguilliformes): novel gene order for vertebrate mitochondrial genomes and the phylogenetic implications for anguilliform families,"J. Mol. Evol. 52 (4), 311-320 (2001)","Inoue,J.G.",02-MAY-2001,Nemichthys scolopaceus mitochondrial gene for 12S rRNA,258,10 Dec 2023,12s.miya,2,170,caccgcggttatacgagcggcccaagttgacattacacggcgtaaagagtgattagaagacctacaaactaaagccaaacccttcccccaagctgtcatacgctcacggataaacgaagacttacaacgaaagtatctttaacaaatttgaactcacgagagtcgaggga
Nemichthys scolopaceus,GENBANK,2174708199,LC669506.1,Animalia,Chordata,Actinopterygii,Anguilliformes,Nemichthyidae,Nemichthys,Nemichthys scolopaceus,2660,"Japan:Shizuoka, Kamo, Nishi-izu, Ugusu, Suruga-wan Bay",CBM:ZF:21777,NA,NA,NA,Reference data for MiFish metabarcoding analysis,Unpublished,"Sado,T.",08-JAN-2022,"Nemichthys scolopaceus CBM:ZF:21777 mitochondrial genes for 12S rRNA, tRNA-Val, 16S rRNA, partial and complete sequence",258,10 Dec 2023,12s.miya,1,170,caccgcggttatacgagcggcccaagttgacattacacggcgtaaagagtgattagaagacctacaaactaaagccaaacccttcccccaagctgtcatacgctcacggataaacgaagacttacaacgaaagtagctttaacaaatttgaactcacgagagtcgaggga
Nemichthys scolopaceus,GENBANK,2497635832,OQ883804.1,Animalia,Chordata,Actinopterygii,Anguilliformes,Nemichthyidae,Nemichthys,Nemichthys scolopaceus,2660,NA,WHOI:OTZ_67,NA,39.20047,-71.14308,Mesopelagic fish diversity and diel vertical migration in the Northwest Atlantic Slope Sea,Unpublished,"Govindarajan,A.",28-NOV-2023,"Nemichthys scolopaceus isolate HB1805_MWT5_178 small subunit ribosomal RNA gene, partial sequence; mitochondrial",258,10 Dec 2023,12s.miya,1,170,caccgcggttatacgagcggcccaagttgacattacacggcgtaaagagtgattagaaaacctacaaactaaagccaaacccctcccccaagctgttatacgctcacggatagacgaagacttccaacgaaagtagctttaataaatttgaactcacgagagtcgaggga
Nemichthys scolopaceus,GENBANK,271280489,AP010854.1,Animalia,Chordata,Actinopterygii,Anguilliformes,Nemichthyidae,Nemichthys,Nemichthys scolopaceus,2660,NA,CBM:ZF-10305,NA,NA,NA,Deep-ocean origin of the freshwater eels,"Biol. Lett. 6 (3), 363-366 (2010)","Inoue,J.G.",11-DEC-2009,"Nemichthys scolopaceus mitochondrial DNA, complete genome",258,10 Dec 2023,12s.miya,3,170,caccgcggttatacgagcggcccaagttgacattacacggcgtaaagagtgattagaagacctacaaactaaagccaaacccttcccccaagctgtcatacgctcacggatagacgaagacttataacgaaagtagctttaacaaatttgaactcacgagagtcgaggga
Nemichthys scolopaceus,GENBANK,405779053,JX242938.1,Animalia,Chordata,Actinopterygii,Anguilliformes,Nemichthyidae,Nemichthys,Nemichthys scolopaceus,2660,NA,KU 27941,NA,NA,NA,"Phylogeny of moray eels (Anguilliformes: Muraenidae), with a revised classification of true eels (Teleostei: Elopomorpha: Anguilliformes)","Mitochondrial DNA 24 (1), 55-66 (2013)","Tang,K.L.",20-SEP-2012,"Nemichthys scolopaceus 12S ribosomal RNA subunit gene, partial sequence; mitochondrial",258,10 Dec 2023,12s.miya,2,170,caccgcggttatacgagcggcccgagttgacattgcacggcgtaaagagtgattagaagacttacaaactaaagccaaacccttcccccaagctgtcatacgctcacggatagacgaagacttacaacgaaagtagctttaacaaatttgaactcacgaaagtcggggca
Nemichthys scolopaceus,GENBANK,985564885,LC020904.1,Animalia,Chordata,Actinopterygii,Anguilliformes,Nemichthyidae,Nemichthys,Nemichthys scolopaceus,2660,NA,HUMZ:222495,NA,NA,NA,"mitochondrial gene for 12S ribosomal RNA, partial sequence of fishes",Unpublished,"Miya,M.",03-FEB-2016,"Nemichthys scolopaceus mitochondrial gene for 12S rRNA, partial sequence, specimen_voucher: HUMZ:222495",258,10 Dec 2023,12s.miya,1,170,caccgcggttatacgagcggcccaagttgacattacacggcgtaaagagtgattagaagacctacaaactaaagccaaacccttcccccaagctgttatacgctcacggatagacgaagatttacaacgaaagtagctttaacaaatttgaactcacgaaagtcgaggga
Serrivomer beanii,GENBANK,2333440988,OP863157.1,Animalia,Chordata,Actinopterygii,Anguilliformes,Serrivomeridae,Serrivomer,Serrivomer beanii,7477,Greenland: Davis Strait,Serrivomer_beanii_P313237,NA,NA,NA,Distinct latitudinal community patterns of Arctic marine vertebrates along the East Greenlandic coast detected by environmental DNA,Divers Distrib (2022) In press,"Jensen,M.R.",20-DEC-2022,"Serrivomer beanii voucher Serrivomer_beanii_P313237 small subunit ribosomal RNA gene, partial sequence; mitochondrial",258,10 Dec 2023,12s.miya,5,170,caccgcggttagacgggaggctcgaattgatgctacacggcgtaaagcgtgattagaaaatcaaacaaactaaagccaaacgcctcctaagctgtaatacgctactggataagacgaagccccacaacgaaagtagctttaataattttgaatacacgacagttaagaaa
Histiobranchus bathybius,GENBANK,33337802,AF120939.1,Animalia,Chordata,Actinopterygii,Anguilliformes,Synaphobranchidae,Histiobranchus,Histiobranchus bathybius,6958,NA,NA,NA,NA,NA,Preliminary examination of phylogenetic position of freshwater eels genus Anguilla (Anguilliformes: Anguillidae),Unpublished,"Inoue,J.",01-APR-2010,"Histiobranchus bathybius 12S ribosomal RNA gene, partial sequence; mitochondrial gene for mitochondrial product",258,10 Dec 2023,12s.miya,1,173,caccgcggttatacgagaggctcaaattgacactctttcggcgtaaagcgtgattagagaccacaattcactaaagccaaacacctcctaagctgtcatacgcaaccagaggcaggaagccccccaacgaaagtagctttaataaacatcttgaattcacgacagttaagaaa
Simenchelys parasitica,GENBANK,405779060,JX242945.1,Animalia,Chordata,Actinopterygii,Anguilliformes,Synaphobranchidae,Simenchelys,Simenchelys parasitica,9102,NA,MCZ 124156,NA,NA,NA,"Phylogeny of moray eels (Anguilliformes: Muraenidae), with a revised classification of true eels (Teleostei: Elopomorpha: Anguilliformes)","Mitochondrial DNA 24 (1), 55-66 (2013)","Tang,K.L.",20-SEP-2012,"Simenchelys parasitica 12S ribosomal RNA subunit gene, partial sequence; mitochondrial",258,10 Dec 2023,12s.miya,1,173,caccgcggttagacgagaggctcaaaattaacactctttcggcgtaaagcgtgattagagccacaacacactaaagccaaacacctcctaagctgtcatacgcaaccagaggcaggaagccccccaacgaaagtagctttaataaacattttgaattcacgacagttaagaaa
Simenchelys parasitica,GENBANK,985564879,LC020898.1,Animalia,Chordata,Actinopterygii,Anguilliformes,Synaphobranchidae,Simenchelys,Simenchelys parasitica,9102,NA,KAUM:I:55792,NA,NA,NA,"mitochondrial gene for 12S ribosomal RNA, partial sequence of fishes",Unpublished,"Miya,M.",03-FEB-2016,"Simenchelys parasitica mitochondrial gene for 12S rRNA, partial sequence, specimen_voucher: KAUM:I:55792",258,10 Dec 2023,12s.miya,6,173,caccgcggttagacgagaggctcaaattgacactctttcggcgtaaagcgtgattagagaccacaacacactaaagccaaacacctcctaagctgtcatacgcaaccagaggcaggaagccccccaacgaaagtagctttaataaacattttgaattcacgacagttaagaaa
Synaphobranchus kaupii,GENBANK,1102318232,KX929922.1,Animalia,Chordata,Actinopterygii,Anguilliformes,Synaphobranchidae,Synaphobranchus,Synaphobranchus kaupii,9104,Greenland,ZMUC P321354,NA,NA,NA,"Environmental DNA from seawater samples correlate with trawl catches of subarctic, deepwater fishes",Unpublished,"Thomsen,P.F.",19-NOV-2016,"Synaphobranchus kaupii voucher ZMUC P321354 12S ribosomal RNA gene, partial sequence; mitochondrial",258,10 Dec 2023,12s.miya,1,137,tcggcgtaagcgtgattaaggactataacaaactaaagccaaacacctcccaagctgtcatacgcaatcggaggcaggaggccccccaacgaaagtagctttaataaacaaatcctgaatccacgacagttaagaaa
Synaphobranchus kaupii,GENBANK,2333440994,OP863160.1,Animalia,Chordata,Actinopterygii,Anguilliformes,Synaphobranchidae,Synaphobranchus,Synaphobranchus kaupii,9104,Greenland: SE,Synaphobranchus_kaupii_P321354,NA,NA,NA,Distinct latitudinal community patterns of Arctic marine vertebrates along the East Greenlandic coast detected by environmental DNA,Divers Distrib (2022) In press,"Jensen,M.R.",20-DEC-2022,"Synaphobranchus kaupii voucher Synaphobranchus_kaupii_P321354 small subunit ribosomal RNA gene, partial sequence; mitochondrial",258,10 Dec 2023,12s.miya,2,174,caccgcggttatacgagaggctcaagttgacacttttcggcgtaaagcgtgattaaggactataacaaactaaagccaaacacctcccaagctgtcatacgcaatcggaggcaggaggccccccaacgaaagtagctttaataaacaaatcctgaatccacgacagttaagaaa
Synaphobranchus kaupii,GENBANK,45259663,AP002977.2,Animalia,Chordata,Actinopterygii,Anguilliformes,Synaphobranchidae,Synaphobranchus,Synaphobranchus kaupii,9104,NA,"CBM-ZF 10302 (Natural History Museum & Institute, Chiba, Japan)",NA,NA,NA,Mitogenomic evidence for the monophyly of elopomorph fishes (Teleostei) and the evolutionary origin of the leptocephalus larva,"Mol. Phylogenet. Evol. 32 (1), 274-286 (2004)","Inoue,J.G.",09-MAR-2004,"Synaphobranchus kaupii mitochondrial DNA, complete genome",258,10 Dec 2023,12s.miya,3,175,caccgcggttatacgaggggctcaagttgacactttttcggcgtaaagcgtgattaaggactataataaactaaagccaaacacctcccaagctgtcatacgcaatcggaggcaggaggccccccaacgaaagtagctttaataaacaaatcttgaattcacgacagttaaggaa
Synaphobranchus kaupii,GENBANK,985564876,LC020895.1,Animalia,Chordata,Actinopterygii,Anguilliformes,Synaphobranchidae,Synaphobranchus,Synaphobranchus kaupii,9104,NA,CBM:ZF:14553,NA,NA,NA,"mitochondrial gene for 12S ribosomal RNA, partial sequence of fishes",Unpublished,"Miya,M.",03-FEB-2016,"Synaphobranchus kaupii mitochondrial gene for 12S rRNA, partial sequence, specimen_voucher: CBM:ZF:14553",258,10 Dec 2023,12s.miya,1,175,caccgcggttatacgaggggctcaagttgacactttttcggcgtaaagcgtggttaaggactataataaactaaagccaaacacctcccaagctgtcatacgcaatcggaggcaggaggccccccaacgaaagtagctttaataaacaaatcttgaattcacgacagttaaggaa
Synaphobranchus kaupii,GENBANK,985566090,LC049668.1,Animalia,Chordata,Actinopterygii,Anguilliformes,Synaphobranchidae,Synaphobranchus,Synaphobranchus kaupii,9104,NA,HUMZ:219213,NA,NA,NA,"mitochondrial gene for 12S ribosomal RNA, partial sequence of fishes",Unpublished,"Miya,M.",03-FEB-2016,"Synaphobranchus kaupii mitochondrial gene for 12S rRNA, partial sequence, specimen_voucher: HUMZ:219213",258,10 Dec 2023,12s.miya,1,175,caccgcggttatacgaggggctcaagttgacactttttcggcgtaaagcgtgattaaggactatagtaaactaaagccaaacacctcccaagctgtcatacgcaatcggaggcaggaggccccccaacgaaagtagctttaataaacaaatcttgaattcacgacagttaaggaa
Atherina boyeri,GENBANK,1209184411,LC277855.1,Animalia,Chordata,Actinopterygii,Atheriniformes,Atherinidae,Atherina,Atherina boyeri,1696,NA,FRLM:37722,NA,NA,NA,"Reference data of mitochondrial 12S ribosomal RNA gene, partial sequence for eDNA analyzing",Unpublished,"Miya,M.",21-JUN-2017,"Atherina boyeri mitochondrial gene for 12S rRNA, partial sequence, specimen_voucher: FRLM:37722",258,10 Dec 2023,12s.miya,1,168,caccgcggttatacgagaggcccaagttgatacccgccggcgtaaagagtggttaaggagactcgcaactaaagccgaatactctcagagctgttatatgtactcgagagcaagaagcccactcacgaaagtagctttaattttcctgaccccacgtaagctgaggaa
Atherina boyeri,GENBANK,1293099600,LC340071.1,Animalia,Chordata,Actinopterygii,Atheriniformes,Atherinidae,Atherina,Atherina boyeri,1696,Mediterranean Sea,NA,NA,NA,NA,"Reference data of mitochondrial 12S ribosomal RNA gene, partial sequence for eDNA analyzing",Unpublished,"Miya,M.",06-DEC-2017,"Atherina boyeri mitochondrial gene for 12S rRNA, partial sequence",258,10 Dec 2023,12s.miya,1,168,caccgcggttatacgagaggcccaagttgatacccgccggcgtaaagagtggttaaggagacccgcaactaaagccgaacactctcagagctgttatatgcacccgagagcaagaagcccactcacgaaagtagctttaatctttctgaccccacgtaagctgagaaa
Atherina boyeri,GENBANK,2018537098,MW818259.1,Animalia,Chordata,Actinopterygii,Atheriniformes,Atherinidae,Atherina,Atherina boyeri,1696,United Kingdom: River Test,NA,NA,50.9013,-1.4406,"A generalised, dynamic DNA reference library pipeline for metabarcoding of fishes",Unpublished,"Collins,R.A.",31-MAR-2021,"Atherina boyeri isolate SEA0161 small subunit ribosomal RNA gene, partial sequence; mitochondrial",258,10 Dec 2023,12s.miya,6,168,caccgcggttatacgagaggcccaagttgatatccgccggcgtaaagagtggttaagagaacccaatactaaagccgaacactctcaaagctgttatatgcacccgagagcaagaagccctctcacgaaagtagctttaacttttctgactccacgtaagctgaggaa
Atherina boyeri,GENBANK,2048073550,MW856895.1,Animalia,Chordata,Actinopterygii,Atheriniformes,Atherinidae,Atherina,Atherina boyeri,1696,Spain,NA,NA,NA,NA,Freshwater Fish Mitochondrial Genome Project,Unpublished,"Maloy,A.P.",08-JUN-2021,"Atherina boyeri isolate F20-001 mitochondrion, complete genome",258,10 Dec 2023,12s.miya,1,168,caccgcggttatacgagaggcccaagttgatacccgccggcgtaaagagtggttaaggagacccgcaactaaagccgaacactctcagagctgttatatgcacccgagagcaagaagcccactcacgaaagtagctttaatcttcctgaccccacgtaagctgagaaa
Atherina boyeri,GENBANK,297655393,GQ352661.1,Animalia,Chordata,Actinopterygii,Atheriniformes,Atherinidae,Atherina,Atherina boyeri,1696,NA,LIGUDG At 5,NA,NA,NA,Phylogenetic inference in Odontesthes and Atherina (Teleostei: Atheriniformes) with insights into ecological adaptation,"C. R. Biol. 334 (4), 273-281 (2011)","Heras,S.",28-APR-2011,"Atherina boyeri haplotype Atb11 tRNA-Phe (trnF) gene, complete sequence; and 12S ribosomal RNA gene, partial sequence; mitochondrial",258,10 Dec 2023,12s.miya,1,168,caccgcggttatacgagaggcccaagttgatacccgccggcgtaaagagtggttaaggagacccgcaactaaagccgaacactctcagagctgttatatgcacccgagagcaagaagcccactcacgaaagtagctttaatcttcctgaccccacgtaagctgaggaa
Atherina boyeri,GENBANK,297655394,GQ352662.1,Animalia,Chordata,Actinopterygii,Atheriniformes,Atherinidae,Atherina,Atherina boyeri,1696,NA,LIGUDG At 6,NA,NA,NA,Phylogenetic inference in Odontesthes and Atherina (Teleostei: Atheriniformes) with insights into ecological adaptation,"C. R. Biol. 334 (4), 273-281 (2011)","Heras,S.",28-APR-2011,"Atherina boyeri haplotype Atb12 tRNA-Phe (trnF) gene, complete sequence; and 12S ribosomal RNA gene, partial sequence; mitochondrial",258,10 Dec 2023,12s.miya,1,168,caccgcggttatacgagaggcccaagttgatacccgccggcgtaaagagtggttaaggagacccacaactaaagccgaacactctcagagctgttatatgcacccgagagcaagaagcccactcacgaaagtagctttaatcttcctgaccccacgtaagctgaggaa
Alepisaurus ferox,GENBANK,806392188,AP004211.1,Animalia,Chordata,Actinopterygii,Aulopiformes,Alepisauridae,Alepisaurus,Alepisaurus ferox,99,NA,NA,NA,NA,NA,Molecular Phylogeny and Evolution of Aulopiformes,Unpublished,"Kawaguchi,A.",07-APR-2015,"Alepisaurus ferox mitochondrial DNA, almost complete genome",258,10 Dec 2023,12s.miya,2,169,caccgcggttatacgaggggcccaagctgacagacgtcggcgtaaagagtggttacggaacgacctaaactaaagttaaacaccccccaaactgttatacgcgcccgggggccggatactccaccacgaaagtgactttaattttcctgaacccaccacagctatggac
Alepisaurus ferox,GENBANK,985567126,LC091793.1,Animalia,Chordata,Actinopterygii,Aulopiformes,Alepisauridae,Alepisaurus,Alepisaurus ferox,99,NA,HUMZ:221156,NA,NA,NA,Reference data for MiFish metabarcoding analysis,Unpublished,"Miya,M.",03-FEB-2016,"Alepisaurus ferox mitochondrial gene for 12S rRNA, partial sequence, specimen_voucher: HUMZ:221156",258,10 Dec 2023,12s.miya,1,169,caccgcggttatacgaggggcccaagctgacagacgtcggcgtaaagagtggttacggaacgacctaaactaaagttaaacaccccccaaactgttatacgcgcccgggggccggatactccgccacgaaagtgactttaattttcctgaacccaccacagctatggtc
Alepisaurus ferox,GENBANK,985567127,LC091794.1,Animalia,Chordata,Actinopterygii,Aulopiformes,Alepisauridae,Alepisaurus,Alepisaurus ferox,99,NA,UW:117706,NA,NA,NA,Reference data for MiFish metabarcoding analysis,Unpublished,"Miya,M.",03-FEB-2016,"Alepisaurus ferox mitochondrial gene for 12S rRNA, partial sequence, specimen_voucher: UW:117706",258,10 Dec 2023,12s.miya,5,169,caccgcggttatacgaggggcccaagctgacagacgtcggcgtaaagagtggttacggaacgacctaaactaaagttaaacaccccccaaactgttatacgcgcccgggggccggatactccgccacgaaagtgactttaattttcctgaacccaccacagctatggac
Bathysaurus ferox,GENBANK,806392090,AP004204.1,Animalia,Chordata,Actinopterygii,Aulopiformes,Bathysauridae,Bathysaurus,Bathysaurus ferox,11841,NA,NA,NA,NA,NA,Molecular Phylogeny and Evolution of Aulopiformes,Unpublished,"Kawaguchi,A.",07-APR-2015,"Bathysaurus ferox mitochondrial DNA, almost complete genome",258,10 Dec 2023,12s.miya,2,171,caccgcggttatacgagaggcccaagttgatagacatcggcgtaaagagtggttacggataataactcatctaaagtcgaacgccccccaaactgttatacgcacccgggggtatgaagccctaccacgaaagtgactttaattttccccgaacccactacagctattaaa
Scopelosaurus lepidus,GENBANK,2333440981,OP863154.1,Animalia,Chordata,Actinopterygii,Aulopiformes,Notosudidae,Scopelosaurus,Scopelosaurus lepidus,9159,Greenland: Davis Strait,Scopelosaurus_lepidus_P2393506,NA,NA,NA,Distinct latitudinal community patterns of Arctic marine vertebrates along the East Greenlandic coast detected by environmental DNA,Divers Distrib (2022) In press,"Jensen,M.R.",20-DEC-2022,"Scopelosaurus lepidus voucher Scopelosaurus_lepidus_P2393506 small subunit ribosomal RNA gene, partial sequence; mitochondrial",258,10 Dec 2023,12s.miya,2,173,caccgcggttatacggggggcccaagctgacaaacatcggcgtaaagagtggttacggaccaaccccacactaaagtcaaacacccctcccgctgttatacgcatccagggacaggaagctccaccacgaaagtgactttaacatctctcccgaacccactacagctagggaa
Arctozenus risso,GENBANK,1918447548,LC578950.1,Animalia,Chordata,Actinopterygii,Aulopiformes,Paralepididae,Arctozenus,Arctozenus risso,6977,Japan:Pacific Ocean off Hokkaido,FAKU:202448,NA,NA,NA,Reference data for MiFish metabarcoding analysis,Unpublished,"Miya,M.",23-OCT-2020,"Arctozenus risso FAKU:202448 mitochondrial gene for 12S rRNA, partial sequence",258,10 Dec 2023,12s.miya,2,171,caccgcggttatacgaggggcccaagctgacagacaccggcgtaaagagtggttaaggattaaccccactaaagtcaaacatcccctatgctgttatacgcctccggggacaggatgccccaccacgaaagtgactttaataaatctcccgaacccacgacagctatgaaa
Arctozenus risso,GENBANK,2333440916,OP863123.1,Animalia,Chordata,Actinopterygii,Aulopiformes,Paralepididae,Arctozenus,Arctozenus risso,6977,NA,Arctozenus_risso_P2402001,NA,NA,NA,Distinct latitudinal community patterns of Arctic marine vertebrates along the East Greenlandic coast detected by environmental DNA,Divers Distrib (2022) In press,"Jensen,M.R.",20-DEC-2022,"Arctozenus risso voucher Arctozenus_risso_P2402001 small subunit ribosomal RNA gene, partial sequence; mitochondrial",258,10 Dec 2023,12s.miya,2,171,caccgcggttatacgaggggcccaagctgacagacaccggcgtaaagagtggttacggattaacctcactaaagtcaaacatcccctatgctgttatacgcctccggggacaggatgccccaccacgaaagtgactttaataaatctcccgaacccaccacagctatgaaa
Arctozenus risso,GENBANK,2497635833,OQ883805.1,Animalia,Chordata,Actinopterygii,Aulopiformes,Paralepididae,Arctozenus,Arctozenus risso,6977,NA,WHOI:OTZ_68,NA,39.00842,-70.52048,Mesopelagic fish diversity and diel vertical migration in the Northwest Atlantic Slope Sea,Unpublished,"Govindarajan,A.",28-NOV-2023,"Arctozenus risso isolate HB1805_MWT1_240 small subunit ribosomal RNA gene, partial sequence; mitochondrial",258,10 Dec 2023,12s.miya,1,171,caccgcggttatacgaggggcccaagctgacagacaccggcgtaaagagtggttacggattaacctcactaaagtcaaacatcccctgtgctgttatacgcctccggggacaggatgccccaccacgaaagtgactttaataaatctcccgaacccaccacagctatgaaa
